Publication Year,Author,Title,Publication Title,ISBN,DOI,Url,Abstract Note,Date,Date Added,Date Modified,Access Date,Pages,Publisher,Language,Manual Tags,Conference Name
2012,"Andreeva, Bistra; Barry, William; Wolska, Magdalena",Language differences in the perceptual weight of prominence-lending properties,Interspeech 2012,,10.21437/Interspeech.2012-635,https://www.isca-speech.org/archive/interspeech_2012/andreeva12_interspeech.html,"A Bulgarian and a German sentence were presented to Bulgarian and German listeners together with a question which either expected an early narrow focus or a late narrow focus. The answering sentences were manipulated so that the word in the latefocused position ranged from completely de-accented to strongly accented. The early focused position was neutral, allowing latefocus perception with late strong accentuation and early focus with de-accentuation of the late-focus position. Accentuation strength of the late position was varied by changing the duration, intensity and f0 values individually between accented and low de-accented. Subjects were asked to judge the suitability of the answers to the question. Results show the relative contribution of the three parameters to the acceptability of the word in the late focus position as focally accented or de-accented. Differences between Bulgarian and German in the relative weighting of the parameters are revealed.",09/09/2012,22/02/2023 10:36,22/02/2023 10:36,30/01/2023 14:17,2426-2429,ISCA,en,prosody,Interspeech 2012
2015,"Aryal, Sandesh; Gutierrez-Osuna, Ricardo",Articulatory-based conversion of foreign accents with deep neural networks,Interspeech 2015,,10.21437/Interspeech.2015-145,https://www.isca-speech.org/archive/interspeech_2015/aryal15_interspeech.html,"We present an articulatory-based method for real-time accent conversion using deep neural networks (DNN). The approach consists of two steps. First, we train a DNN articulatory synthesizer for the non-native speaker that estimates acoustics from contextualized articulatory gestures. Then we drive the DNN with articulatory gestures from a reference native speaker –mapped to the nonnative articulatory space via a Procrustes transform. We evaluate the accent-conversion performance of the DNN through a series of listening tests of intelligibility, voice identity and nonnative accentedness. Compared to a baseline method based on Gaussian mixture models, the DNN accent conversions were found to be 31% more intelligible, and were perceived more native-like in 68% of the cases. The DNN also succeeded in preserving the voice identity of the nonnative speaker.",06/09/2015,22/02/2023 10:36,26/02/2023 12:55,30/01/2023 14:17,3385-3389,ISCA,en,L2; voice-conversion; no-motivation; no-description-of-accent,Interspeech 2015
2007,"Barry, William; Andreeva, Bistra; Steiner, Ingmar",The phonetic exponency of phrasal accentuation in French and German,Interspeech 2007,,10.21437/Interspeech.2007-355,https://www.isca-speech.org/archive/interspeech_2007/barry07_interspeech.html,"The acoustic-phonetic properties of words spoken with three different levels of accentuation (de-accented, pre-nuclear and nuclear accented in broad-focus and nuclear accented in narrow-focus) are examined in question-answer elicited sentences and iterative imitations (on the syllable da) produced by six French and six German speakers. Normalised parameter values allow a comparative weighting of the properties employed in differentiating the three levels of accentuation. Clear differences are found between French and German in the weighting hierarchy of the acoustic properties.",27/08/2007,22/02/2023 10:36,22/02/2023 10:36,30/01/2023 14:17,1010-1013,ISCA,en,prosody,Interspeech 2007
2015,"Chen, Mingming; Yang, Zhanlei; Liang, Jizhong; Li, Yanpeng; Liu, Wenju",Improving deep neural networks based multi-accent Mandarin speech recognition using i-vectors and accent-specific top layer,Interspeech 2015,,10.21437/Interspeech.2015-718,https://www.isca-speech.org/archive/interspeech_2015/chen15s_interspeech.html,"In this paper, we propose a method that use i-vectors and model adaptation techniques to improve the performance of deep neural networks(DNNs) based multi-accent Mandarin speech recognition. I-vectors which are speaker-speciﬁc features have been proved to be effective when used in accent identiﬁcation. They can be used in company with conventional spectral features as the input features of DNNs to improve the discrimination for different accents. Meanwhile, we adapt DNNs to different accents by using an accent-speciﬁc top layer and shared hidden layers. The accent-speciﬁc top layer is used to adapt to different accents while the share hidden layers which can be seen as feature extractors can extract discriminative highlevel features between different accents. These two techniques are complementary and can be easily combined together. Our experiments on the 400-hours Intel Accented Mandarin Speech Recognition Corpus show that our proposed method can signiﬁcantly improve the performance of DNNs-based accented Mandarin speech recognition.",06/09/2015,22/02/2023 10:36,07/03/2023 11:32,30/01/2023 14:17,3620-3624,ISCA,en,mandarin; L1; no-description-of-accent; wrong-def; lang-in-title,Interspeech 2015
2022,"Chung, Raymond; Mak, Brian",Synthesizing Near Native-accented Speech for a Non-native Speaker by Imitating the Pronunciation and Prosody of a Native Speaker,Interspeech 2022,,10.21437/Interspeech.2022-11124,https://www.isca-speech.org/archive/interspeech_2022/chung22_interspeech.html,"This paper investigates how to reduce foreign accent in the synthesis of native (L1) speech for a non-native (L2) speaker. We focus on two major aspects of foreign accents: mispronunciations and improper prosody (rhythm, phonemes duration, and pauses). Firstly, to reduce mispronunciations, the melspectrograms generated by an L2 text-to-speech (TTS) model are fed to a pre-trained speech recognizer and the mispronunciation information is fed back to the TTS model during back-propagation to help the model learn correct native melspectrograms. Secondly, to imitate L1 speech prosody, a recent data augmentation (DA) technique originally proposed for speaking style transfer is applied to transfer L1 speaking style to L2 speakers. The DA technique creates additional L2 speeches when L2 speakers try to imitate L1 speeches. Automatic speech recognition on native-accented speeches synthesized from nonnative speakers by the proposed method gives a lower word error rate. The speaker embeddings produced by a pre-trained speaker veriﬁer from the original L2 speakers’ speech and their synthesized speech are highly similar. Finally, subjective MOS scores on the synthesized speech show that they have good quality and reduced accentedness.",18/09/2022,22/02/2023 10:36,27/02/2023 07:42,30/01/2023 14:17,4302-4306,ISCA,en,L2; voice-conversion; synthesis; TTS; teaching; accentedness-rating,Interspeech 2022
2018,"Davis, Chris; Kim, Jeesun",Characterizing Rhythm Differences between Strong and Weak Accented L2 Speech,Interspeech 2018,,10.21437/Interspeech.2018-1798,https://www.isca-speech.org/archive/interspeech_2018/davis18_interspeech.html,"This study examined the rhythmic characteristics of accented L2 speech by using two relatively novel measures of prosodic rhythm: The S-AMPH measure, an index of the degree of synchrony between the stress and syllable amplitude modulation rates; and the Allan Factor measure, that determines the nested clustering of temporal events (in this case peaks in the amplitude envelope) over different timescales. An extremegroup design was used to select strong versus weak foreign accent recordings from a group of Korean and French L2 English talkers saying the same 69-word English passage. For the Korean talkers, both the S-AMPH and the Allan Factor measures differed as a function of the strength of foreign accent. This was not the case for the French talkers, where neither measure differed as a function of foreign accent strength. The difference in outcome between the Korean and French talkers suggests that the measures are not indexing some general property of L2 accent (e.g., production fluency) but rather that picking up some property specific to the strongly accented Korean talkers. We consider several options.",02/09/2018,22/02/2023 10:36,07/03/2023 12:47,30/01/2023 14:17,2568-2572,ISCA,en,L2; perception-study; some-description; accentedness-rating; unaccented/non-accented; speaker-description; no-listener-description,Interspeech 2018
2021,"Deng, Keqi; Cao, Songjun; Ma, Long",Improving Accent Identification and Accented Speech Recognition Under a Framework of Self-Supervised Learning,Interspeech 2021,,10.21437/Interspeech.2021-1186,https://www.isca-speech.org/archive/interspeech_2021/deng21b_interspeech.html,"Recently, self-supervised pre-training has gained success in automatic speech recognition (ASR). However, considering the difference between speech accents in real scenarios, how to identify accents and use accent features to improve ASR is still challenging. In this paper, we employ the self-supervised pre-training method for both accent identiﬁcation and accented speech recognition tasks. For the former task, a standard deviation constraint loss (SDC-loss) based end-to-end (E2E) architecture is proposed to identify accents under the same language. As for accented speech recognition task, we design an accent-dependent ASR system, which can utilize additional accent input features. Furthermore, we propose a frame-level accent feature, which is extracted based on the proposed accent identiﬁcation model and can be dynamically adjusted. We pretrain our models using 960 hours unlabeled LibriSpeech dataset and ﬁne-tune them on AESRC2020 speech dataset. The experimental results show that our proposed accent-dependent ASR system is signiﬁcantly ahead of the AESRC2020 baseline and achieves 6.5% relative word error rate (WER) reduction compared with our accent-independent ASR system.",30/08/2021,22/02/2023 10:36,22/02/2023 10:36,30/01/2023 14:17,1504-1508,ISCA,en,accent-identification,Interspeech 2021
2006,"Ding, Pei; He, Lei; Yan, Xiang; Hao, Jie",Robust automatic speech recognition for accented Mandarin in car environments,Interspeech 2006,,10.21437/Interspeech.2006-637,https://www.isca-speech.org/archive/interspeech_2006/ding06_interspeech.html,,17/09/2006,22/02/2023 10:36,07/03/2023 11:33,30/01/2023 14:17,paper 1764-Thu2CaP.6-0,ISCA,en,ASR; mandarin; L1; no-description-of-accent; lang-in-title,Interspeech 2006
2008,"Ding, Guo-Hong",Phonetic confusion analysis and robust phone set generation for Shanghai-accented Mandarin speech recognition,Interspeech 2008,,10.21437/Interspeech.2008-344,https://www.isca-speech.org/archive/interspeech_2008/ding08d_interspeech.html,"In this paper, accent issues are discussed for Shanghai-accented Mandarin speech recognition. The phonetic confusion is analyzed in detail based on the alignment between the surface form and the baseform transcriptions. Mutual information is used as the measure to extract the most confusing phoneme pairs. It was found that each phoneme in one pair can be easily misrecognized with the other. To remove the phonetic confusion, it is better to replace the two phonemes in one pair with a newly generated one. Consequentially new phone sets are derived. The phonetic confusion analysis and the experimental evaluation are performed on a Shanghai-accented Mandarin speech corpus. Experimental results show that compared to the canonical phone set, the generated one can reduce the substitution error greatly and achieve a 0.72% absolute Chinese character error rate (CER) reduction. When it is combined with pronunciation modeling, the absolute CER reduction is 1.58%.",22/09/2008,22/02/2023 10:36,07/03/2023 11:32,30/01/2023 14:17,1129-1132,ISCA,en,ASR; mandarin; L1; some-description; accent-in-title,Interspeech 2008
2004,"Dohen, Marion; Loevenbruck, Helene","Pre-focal rephrasing, focal enhancement and postfocal deaccentuation in French",Interspeech 2004,,10.21437/Interspeech.2004-296,https://www.isca-speech.org/archive/interspeech_2004/dohen04_interspeech.html,"This study aims at better describing the acoustic correlates of contrastive focus in French. A corpus was recorded from a male native speaker of French. It consisted of sentences with a subject-verb-object (SVO) structure under four conditions: focus on each phrase (S,V,O) and broad focus. The focal, pre-focal and post-focal constituents were studied separately. The acoustic analysis showed that: a) the pitch of the focal constituent rises, b) that of the surrounding constituents decreases, c) the duration of the focal syllables and of the pre-focal syllable increases, the onset of the focal constituent increasing the most, d) the pre-focal sequence is rephrased, e) the post-focal sequence is deaccented.",04/10/2004,22/02/2023 10:36,22/02/2023 10:36,30/01/2023 14:18,785-788,ISCA,en,prosody,Interspeech 2004
2018,"Fukuda, Takashi; Fernandez, Raul; Rosenberg, Andrew; Thomas, Samuel; Ramabhadran, Bhuvana; Sorin, Alexander; Kurata, Gakuto",Data Augmentation Improves Recognition of Foreign Accented Speech,Interspeech 2018,,10.21437/Interspeech.2018-1211,https://www.isca-speech.org/archive/interspeech_2018/fukuda18_interspeech.html,"Speech recognition of foreign accented (non-native or L2) speech remains a challenge to the state-of-the-art. The most common approach to address this scenario involves the collection and transcription of accented speech, and incorporating this into the training data. However, the amount of accented data is dwarfed by the amount of material from native (L1) speakers, limiting the impact of the additional material. In this work, we address this problem via data augmentation. We create modiﬁed copies of two accents, Latin American and Asian accented English speech with voice transformation (modifying glottal source and vocal tract parameters), noise addition, and speed modiﬁcation. We investigate both supervised (where transcription of the accented data is available) and unsupervised approaches to using the accented data and associated augmentations. We ﬁnd that all augmentations provide improvements, with the largest gains coming from speed modiﬁcation, then voice transformation and noise addition providing the least improvement. The improvements from training accent speciﬁc models with the augmented data are substantial. Improvements from supervised and unsupervised adaptation (or training with soft labels) with the augmented data are relatively minor. Overall, we ﬁnd speed modiﬁcation to be a remarkably reliable data augmentation technique for improving recognition of foreign accented speech. Our strategies with associated augmentations provide Word Error Rate (WER) reductions of up to 30% relative over a baseline trained with only the accented data.",02/09/2018,22/02/2023 10:36,01/03/2023 17:01,30/01/2023 14:18,2409-2413,ISCA,en,ASR; L2; data-augmentation; definition; some-description,Interspeech 2018
2015,"Grohe, Ann-Kathrin; Poarch, Gregory J.; Hanulíková, Adriana; Weber, Andrea",Production inconsistencies delay adaptation to foreign accents,Interspeech 2015,,10.21437/Interspeech.2015-627,https://www.isca-speech.org/archive/interspeech_2015/grohe15_interspeech.html,"The effects of production inconsistencies and speaker’s accented production preferences on speech comprehension were investigated in an eyetracking experiment. Using the visual world paradigm, native speakers of German with L2 English listened to single English words produced by a German speaker that had their th either pronounced canonically or substituted with an /s/ or a /t/. Looks to the target word were most likely for the canonical pronunciation and did not differ between the substitutes. However, target looks increased for items with th substitutions in the course of the experiment, indicating slow adaptation to inconsistently foreign accented speech.",06/09/2015,22/02/2023 10:36,07/03/2023 13:57,30/01/2023 14:18,3115-3119,ISCA,en,english; L2; not-tech; perception-study; some-description; listener-description; no-speaker-description,Interspeech 2015
2020,"Hirschi, Kevin; Kang, Okim; Cucchiarini, Catia; Hansen, John H.L.; Evanini, Keelan; Strik, Helmer",Mobile-Assisted Prosody Training for Limited English Proficiency: Learner Background and Speech Learning Pattern,Interspeech 2020,,10.21437/Interspeech.2020-2901,https://www.isca-speech.org/archive/interspeech_2020/hirschi20_interspeech.html,"The use of Mobile-Assisted Pronunciation Training (MAPT) has been increasing drastically due to the personal and interactive nature of mobile devices. However, MAPT applications lack support from empirical evidence as research on MAPT-based acquisition, particularly related to prosody, has been rare. The present study employs a MAPT application with lessons on lexical stress and prominence with Limited English Proficiency (LEP) users (n = 31) of mixed ages and first languages. Then, 16 experienced raters conducted discoursebased prosodic analysis on unconstrained speech collected at the beginning and the end of the intervention. A series of mixedeffect model analyses were conducted on learner effort, improvement and learner background to investigate their relationship with accentedness and comprehensibility. The results indicated that present MAPT prosody interventions were effective for comprehensibility but not accentedness, however, learner effort on lexical stress and prominence exhibit differing patterns. Similar to previous findings, learner age impacts production more than the length of residency or history of language study. Implications include a prosody-based MAPT application; support for the treatment of accentedness and comprehensibility as separate, but related constructs; and a further understanding of the role of learner-related factors in prosody intervention.",25/10/2020,22/02/2023 10:36,07/03/2023 11:27,30/01/2023 14:18,4452-4456,ISCA,en,ASR; L2; teaching; accentedness-rating; almost-no-description; lang-in-title,Interspeech 2020
2013,"Hou, Luying; Jia, Yuan; Li, Aijun",Phonetic manifestation and influence of zero anaphora in Chinese reading texts,Interspeech 2013,,10.21437/Interspeech.2013-372,https://www.isca-speech.org/archive/interspeech_2013/hou13_interspeech.html,"The present paper conducts a pioneering study on the phonetic manifestation and influence of zero anaphora in Chinese reading texts. The stress degree of the boundary syllable and the duration of the pause at the anaphoric position are examined. The results show: i) the boundary syllable after zero anaphoric form is more accented; for the two types of zero anaphora concerned in this study, the boundary syllable after distant zero anaphoric form is more accented than that after immediate zero anaphoric form; ii) the boundary syllable before immediate anaphoric form is more accented than that before distant anaphoric form; iii) the pause before immediate zero anaphoric form is shorter than that before other types of anaphoric forms. Based on these results, the study further proposes that the syllable weight of the underlying anaphoric form is projected to the following syllable in the surface representation. Moreover, semantic distance and relation can account for the differences between distant and immediate zero anaphora.",25/08/2013,22/02/2023 10:36,22/02/2023 10:36,30/01/2023 14:18,1424-1428,ISCA,en,prosody; mandarin,Interspeech 2013
2017,"Hou, Luying; Bruyn, Bert Le; Kager, René",Disambiguate or not? — The Role of Prosody in Unambiguous and Potentially Ambiguous Anaphora Production in Strictly Mandarin Parallel Structures,Interspeech 2017,,10.21437/Interspeech.2017-1214,https://www.isca-speech.org/archive/interspeech_2017/hou17_interspeech.html,"It has been observed that the interpretation of pronouns can depend on their accentuation patterns in parallel sentences as “John hit Bill and then George hit him”, in which ‘him’ refers to Bill when unaccented but shifts to John when accented. While accentuation is widely regarded as a means of disambiguation, some studies have noticed that it also extends to unambiguous anaphors [7-10]. From the perspective of production, however, no strong experimental confirmation was found for the ‘shift’ function of accented pronouns, which is due to the fact that production research has mainly focused on corpora [5, 6]. Hence, the nature of the accent on anaphors still remains obscure. By manipulating referential shift and ambiguity, this study explores the role of prosody in anaphora production in strictly Mandarin parallel structures. The results reveal a significantly higher F0 and longer duration for anaphors in referentially shifted conditions, suggesting that anaphoric accentuation signals a referential change in strictly parallel structures in Mandarin. No evidence was found that ambiguity plays a role in anaphoric accentuation. This finding challenges the general view on accented pronouns and will deepen our understanding on semantics-prosody relationship.",20/08/2017,22/02/2023 10:36,22/02/2023 10:36,30/01/2023 14:18,1393-1397,ISCA,en,prosody; mandarin,Interspeech 2017
2018,"Jain, Abhinav; Upreti, Minali; Jyothi, Preethi",Improved Accented Speech Recognition Using Accent Embeddings and Multi-task Learning,Interspeech 2018,,10.21437/Interspeech.2018-1864,https://www.isca-speech.org/archive/interspeech_2018/jain18_interspeech.html,"One of the major remaining challenges in modern automatic speech recognition (ASR) systems for English is to be able to handle speech from users with a diverse set of accents. ASR systems that are trained on speech from multiple English accents still underperform when confronted with a new speech accent. In this work, we explore how to use accent embeddings and multi-task learning to improve speech recognition for accented speech. We propose a multi-task architecture that jointly learns an accent classiﬁer and a multi-accent acoustic model. We also consider augmenting the speech input with accent information in the form of embeddings extracted by a separate network. These techniques together give signiﬁcant relative performance improvements of 15% and 10% over a multi-accent baseline system on test sets containing seen and unseen accents, respectively.",02/09/2018,22/02/2023 10:36,27/02/2023 08:14,30/01/2023 14:18,2454-2458,ISCA,en,ASR; L1-or-L2; no-description-of-accent; definition,Interspeech 2018
2005,"Jilka, Matthias",Exploration of different types of intonational deviations in foreign-accented and synthesized speech,Interspeech 2005,,10.21437/Interspeech.2005-44,https://www.isca-speech.org/archive/interspeech_2005/jilka05_interspeech.html,"The study provides an analysis of the basic manifestations of intonational deviations in foreign-accented (American English accent in German) and synthesized speech. It takes into account the crucial influence of the used model of intonation description and makes a major distinction between individual deviations that cause the impression of foreignness or unnaturalness immediately when they occur, and others that do so only when an accumulation of several such deviations does not allow for a meaningful interpretation anymore. It is argued that this is due to the high variability allowed in prosodic contexts. A closer description of the first group of deviations includes the transfer of categories and of the phonetic realizations of categories as well as a discussion of seemingly unmotivated errors and the most likely causes of intonation errors in synthesized speech. Finally, it is shown that in the case of foreign accent the language-specific manifestations of the presented deviations combine to create a characteristic overall impression of foreignness that is recognizable independently of the segmental content of an utterance.",04/09/2005,22/02/2023 10:36,26/02/2023 11:17,30/01/2023 14:18,2393-2396,ISCA,en,L2; teaching; speech-error-detection; some-description; foreign-accent,Interspeech 2005
2020,"Khandelwal, Kartik; Jyothi, Preethi; Awasthi, Abhijeet; Sarawagi, Sunita",Black-Box Adaptation of ASR for Accented Speech,Interspeech 2020,,10.21437/Interspeech.2020-3162,https://www.isca-speech.org/archive/interspeech_2020/khandelwal20_interspeech.html,"We introduce the problem of adapting a black-box, cloud-based ASR system to speech from a target accent. While leading online ASR services obtain impressive performance on mainstream accents, they perform poorly on sub-populations — we observed that the word error rate (WER) achieved by Google’s ASR API on Indian accents is almost twice the WER on US accents. Existing adaptation methods either require access to model parameters or overlay an error correcting module on output transcripts. We highlight the need for correlating outputs with the original speech to ﬁx accent errors. Accordingly, we propose a novel coupling of an open-source accent-tuned local model with the black-box service where the output from the service guides frame-level inference in the local model. Our ﬁne-grained merging algorithm is better at ﬁxing accent errors than existing word-level combination strategies. Experiments on Indian and Australian accents with three leading ASR models as service, show that we achieve upto 28% relative reduction in WER over both the local and service models.",25/10/2020,22/02/2023 10:36,27/02/2023 08:14,30/01/2023 14:18,1281-1285,ISCA,en,ASR; L1-or-L2; some-description; no-def,Interspeech 2020
