Publication Year,Author,Title,Publication Title,ISBN,DOI,Url,Abstract Note,Date,Date Added,Date Modified,Access Date,Pages,Publisher,Language,Manual Tags,Conference Name
2020,"Pérez-Ramón, Rubén; Lecumberri, María Luisa García; Cooke, Martin",The Effect of Language Proficiency on the Perception of Segmental Foreign Accent,Interspeech 2020,,10.21437/Interspeech.2020-1023,https://www.isca-speech.org/archive/interspeech_2020/perezramon20_interspeech.html,"Foreign accent has different effects on speech intelligibility for native and non-native listeners. However, not much is known about the impact of individual foreign-accented segments on listeners with different levels of proﬁciency in the language. Using a technique developed to generate degrees of segmental foreign accent, this study investigates how native and non-native listeners differing in language proﬁciency categorise and discriminate degrees of accentedness at the segmental level. Listeners responded to continua ranging from Spanish-accented tokens to English tokens, constructed by inserting accented segments into words. Six continua were chosen, based on known problems faced by Spanish speakers of English. Whether foreign accent categorisation performance differed across native and nonnative listeners was found to depend on the status of the segment in the listeners’ ﬁrst language. For certain sounds both high and low proﬁciency non-native groups resembled native listener responses. For other sounds, categorisation revealed a clear effect of proﬁciency, with the high-proﬁciency group closer to native performance than the low proﬁciency cohort. This behaviour indicates an ongoing process of new second language phonemic category creation by the more proﬁcient learners.",25/10/2020,22/02/2023 10:36,07/03/2023 13:52,31/01/2023 08:26,2362-2366,ISCA,en,L2; perception-study; some-description; accentedness-rating; speaker-description; listener-description,Interspeech 2020
2012,"Saikachi, Yoko; Kitahara, Mafuyu; Nishikawa, Ken'ya; Kanato, Ai; Mazuka, Reiko",The F0 fall delay of lexical pitch accent in Japanese infant-directed speech,Interspeech 2012,,10.21437/Interspeech.2012-644,https://www.isca-speech.org/archive/interspeech_2012/saikachi12_interspeech.html,"The current study examined the acoustic modifications of the lexical pitch accent in Tokyo Japanese infant-directed speech (IDS), with the focus on the F0 fall delay, where the alignment of the F0 turning points associated with pitch accents were delayed with respect to the accented mora. The RIKEN MotherInfant Conversation Corpus (R-JMICC) [1] produced by 21 mothers from Tokyo area, was used to investigate the alignment of the F0 turning points. Two-piece linear regression was used to locate the turning points and the frequency of F0 fall delay was computed in IDS and in adult-directed speech (ADS). The results revealed that the frequency of F0 fall delay depended on the syllable structures of the accented syllable as well as the prosodic conditions (the presence of the boundary pitch movements and non-lexical lengthening) typically observed in Japanese IDS. We found significantly more frequent F0 fall delay in IDS compared to ADS, when the prosodic conditions were taken into account. The results indicate that the languagespecific prosodic structure should be considered in order to characterize the F0 fall delay of lexical pitch accents in IDS.",09/09/2012,22/02/2023 10:36,22/02/2023 10:36,31/01/2023 08:26,2486-2489,ISCA,en,prosody,Interspeech 2012
2009,"Sangwan, Abhijeet; Hansen, John H. L.",On the use of phonological features for automatic accent analysis,Interspeech 2009,,10.21437/Interspeech.2009-68,https://www.isca-speech.org/archive/interspeech_2009/sangwan09_interspeech.html,"In this paper, we present an automatic accent analysis system that is based on phonological features (PFs). The proposed system exploits the knowledge of articulation embedded in phonology by rapidly build Markov models (MMs) of PFs extracted from accented speech. The Markov models capture information in the PF space along two dimensions of articulation: PF state-transitions and state-durations. Furthermore, by utilizing MMs of native and non-native accents a new statistical measure of “accentedness” is developed which rates the articulation of a word on a scale of native-like (−1) to non-native like (+1. The proposed methodology is then used to perform an automatic cross-sectional study of accented English spoken by native speakers of Mandarin Chinese (N-MC). The experimental results demonstrate the capability of the proposed system to rapidly perform quantitative as well as qualitative analysis of foreign accents. The work developed in this paper is easily assimilated into language learning systems, and has impact in the areas of speaker and speech recognition.",06/09/2009,22/02/2023 10:36,26/02/2023 11:50,31/01/2023 08:26,172-175,ISCA,en,english; L2; accent-identification; teaching; some-description; accentedness-rating,Interspeech 2009
2016,"Scharenborg, Odette; Kolkman, Elea; Kakouros, Sofoklis; Post, Brechtje",The Effect of Sentence Accent on Non-Native Speech Perception in Noise,Interspeech 2016,,10.21437/Interspeech.2016-19,https://www.isca-speech.org/archive/interspeech_2016/scharenborg16b_interspeech.html,"This paper investigates the uptake and use of prosodic information signalling sentence accent during native and nonnative speech perception in the presence of background noise. A phoneme monitoring experiment was carried out in which English, Dutch, and Finnish listeners were presented with target phonemes in semantically unpredictable yet meaningful English sentences. Sentences were presented in different levels of speech-shaped noise and, crucially, in two prosodic contexts in which the target-bearing word was either deaccented or accented. Results showed that overall performance was high for both the native and the non-native listeners; however, where native listeners seemed able to partially overcome the problems at the acoustic level in degraded listening conditions by using prosodic information signalling upcoming sentence accent, non-native listeners could not do so to the same extent. These results support the hypothesis that the performance difference between native and non-native listeners in the presence of background noise is, at least partially, caused by a reduced exploitation of contextual information during speech processing by non-native listeners.",08/09/2016,22/02/2023 10:36,22/02/2023 10:36,31/01/2023 08:26,863-867,ISCA,en,prosody; not-teh,Interspeech 2016
2010,"Schweitzer, Katrin; Walsh, Michael; Möbius, Bernd; Schütze, Hinrich",Frequency of occurrence effects on pitch accent realisation,Interspeech 2010,,10.21437/Interspeech.2010-69,https://www.isca-speech.org/archive/interspeech_2010/schweitzer10_interspeech.html,"This paper presents the results of a corpus study which examines the impact of frequency of occurrence of accented words on the realisation of pitch accents. In particular, statistical analyses explore this inﬂuence on pitch accent range and alignment. The results indicate a signiﬁcant effect of frequency of occurrence on the relative height of L*H and H*L pitch accents and an also signiﬁcant but more subtle effect on the alignment of L*H accents.",26/09/2010,22/02/2023 10:36,22/02/2023 10:36,31/01/2023 08:26,138-141,ISCA,en,prosody,Interspeech 2010
2007,"Shue, Yen-Liang; Iseli, Markus; Veilleux, Nanette; Alwan, Abeer",Pitch accent versus lexical stress: quantifying acoustic measures related to the voice source,Interspeech 2007,,10.21437/Interspeech.2007-690,https://www.isca-speech.org/archive/interspeech_2007/shue07_interspeech.html,"In this paper, we explore acoustic correlates of pitch accent and main lexical stress in American English, and the interaction of these cues with other factors that affect prosody. In a controlled study, we varied presence or absence and type of pitch accent (L∗ vs H∗), boundary-related tone sequence (L-L% vs. HH%) and gender of the talker, for the sentence “Dagada gave Bobby doodads”. The measures were duration, F0 (fundamental frequency), H1∗−H2∗ (related to open quotient), and H1∗−A∗3 (related to spectral tilt). Contour approximations were used to analyze time-course movements of these measures. For “Dagada” we found that, consistent with earlier literature, a) H∗ and L∗ pitch accents showed different F0 contours, b) pitchaccented syllables were longer than unaccented ones, c) stressed “ga” syllables had lower H1∗ − H2∗ values than surrounding unstressed syllables, and for male talkers, lower H1∗ − A∗3 values, indicating lesser spectral tilt. Unexpectedly, F0 maxima associated with an H∗ accent occurred most of the time later in the accented syllable than F0 minima associated with L∗. The cues to lexical stress were consistent with or without pitch accent (e.g. lower H1∗ − H2∗), but they sometimes interacted with gender and/or boundary tones: for example, lower H1∗ − A∗3 in stressed “ga” syllables was only found for female talkers in unaccented cases, and some cues of both accent and stress were less pronounced in the ﬁnal word “doodads”, which also carried boundary-related tones.",27/08/2007,22/02/2023 10:36,22/02/2023 10:36,31/01/2023 08:26,2625-2628,ISCA,en,prosody,Interspeech 2007
2008,"Shue, Yen-Liang; Shattuck-Hufnagel, Stefanie; Iseli, Markus; Jun, Sun-Ah; Veilleux, Nanette; Alwan, Abeer",Effects of intonational phrase boundaries on pitch-accented syllables in american English,Interspeech 2008,,10.21437/Interspeech.2008-279,https://www.isca-speech.org/archive/interspeech_2008/shue08_interspeech.html,"Recent studies of the acoustic correlates of various prosodic elements in American English, such as prominence (in the form of phrase-level pitch accents and word-level lexical stress) and boundaries (in the form of boundary-marking tones), have begun to clarify the nature of the acoustic cues to different types and levels of these prosodic markers. This study focuses on the importance of controlling for context in such investigations, illustrating the effects of adjacent context by examining the cues to H* and L* pitch accent in early and late position in the Intonational Phrase, and how these cues vary when the accented syllable is followed immediately by boundary tones. Results show that F0 peaks for H* accents occur significantly earlier in words that also carry boundary tones, and that energy patterns are also affected; some effects on voice quality measures were also noted. Such findings highlight the caveat that the context of a particular prosodic target may significantly influence its acoustic correlates.",22/09/2008,22/02/2023 10:36,22/02/2023 10:36,31/01/2023 08:26,873-876,ISCA,en,prosody,Interspeech 2008
2005,"Tjalve, Michael; Huckvale, Mark",Pronunciation variation modelling using accent features,Interspeech 2005,,10.21437/Interspeech.2005-487,https://www.isca-speech.org/archive/interspeech_2005/tjalve05_interspeech.html,"In this paper, we propose a novel method for modelling native accented speech. As an alternative to the notion of dialect, we work with the lower level phonological components of accents, which we term accent features. This provides us with a better understanding of how pronunciation varies and it allows us to give a much more detailed picture of a person’s speech.",04/09/2005,22/02/2023 10:36,27/02/2023 07:56,31/01/2023 08:26,1341-1344,ISCA,en,ASR; L1-or-L2; description-of-accent; definition,Interspeech 2005
2015,"Toman, Markus; Pucher, Michael",Evaluation of state mapping based foreign accent conversion,Interspeech 2015,,10.21437/Interspeech.2015-122,https://www.isca-speech.org/archive/interspeech_2015/toman15_interspeech.html,We present an evaluation of the perception of foreign-accented natural and synthetic speech in comparison to accent-reduced synthetic speech. Our method for foreign accent conversion is based on mapping of Hidden Semi-Markov Model states between accented and non-accented voice models and does not need an average voice model of accented speech. We employ the method on recorded data of speakers with ﬁrst language (L1) from different European countries and second language (L2) being Austrian German. Results from a subjective evaluation show that the proposed method is able to signiﬁcantly reduce the perceived accent. It also retains speaker similarity when an average voice model of the same gender is used. Accentedness of synthetic speech was rated signiﬁcantly lower than natural speech by the participants and listeners were unable to identify accents correctly for 81% of the natural and 85% of the synthesized samples. Our evaluation shows the feasibility of accent conversion with a limited amount of speech resources.,06/09/2015,22/02/2023 10:36,07/03/2023 13:44,31/01/2023 08:26,304-308,ISCA,en,L2; no-description-of-accent; perception-study; teaching; accentedness-rating; unaccented/non-accented; accent-reduction; no-listener-description; no-speaker-description,Interspeech 2015
2018,"Tu, Ming; Grabek, Anna; Liss, Julie; Berisha, Visar",Investigating the Role of L1 in Automatic Pronunciation Evaluation of L2 Speech,Interspeech 2018,,10.21437/Interspeech.2018-1350,https://www.isca-speech.org/archive/interspeech_2018/tu18_interspeech.html,"Automatic pronunciation evaluation plays an important role in pronunciation training and second language education. This ﬁeld draws heavily on concepts from automatic speech recognition (ASR) to quantify how close the pronunciation of nonnative speech is to native-like pronunciation. However, it is known that the formation of accent is related to pronunciation patterns of both the target language (L2) and the speaker’s ﬁrst language (L1). In this paper, we propose to use two native speech acoustic models, one trained on L2 speech and the other trained on L1 speech. We develop two sets of measurements that can be extracted from two acoustic models given accented speech. A new utterance-level feature extraction scheme is used to convert these measurements into a ﬁxed-dimension vector which is used as an input to a statistical model to predict the accentedness of a speaker. On a data set consisting of speakers from 4 different L1 backgrounds, we show that the proposed system yields improved correlation with human evaluators compared to systems only using the L2 acoustic model.",02/09/2018,22/02/2023 10:36,07/03/2023 13:54,31/01/2023 08:26,1636-1640,ISCA,en,L2; perception-study; teaching; accentedness-rating; unaccented/non-accented; no-listener-description; no-speaker-description,Interspeech 2018
2010,"Vergyri, Dimitra; Lamel, Lori; Gauvain, Jean-Luc",Automatic speech recognition of multiple accented English data,Interspeech 2010,,10.21437/Interspeech.2010-477,https://www.isca-speech.org/archive/interspeech_2010/vergyri10_interspeech.html,"Accent variability is an important factor in speech that can signiﬁcantly degrade automatic speech recognition performance. We investigate the effect of multiple accents on an English broadcast news recognition system. A multi-accented English corpus is used for the task, including broadcast news segments from 6 different geographic regions: US, Great Britain, Australia, North Africa, Middle East and India. There is signiﬁcant performance degradation of a baseline system trained on only US data when confronted with shows from other regions. The results improve signiﬁcantly when data from all the regions are included for accent-independent acoustic model training. Further improvements are achieved when MAP-adapted accentdependent models are used in conjunction with a GMM accent classiﬁer.",26/09/2010,22/02/2023 10:36,27/02/2023 08:14,31/01/2023 08:26,1652-1655,ISCA,en,ASR; L1-or-L2; no-description-of-accent; no-def,Interspeech 2010
2010,"Yanushevskaya, Irena; Gobl, Christer; Kane, John; Ní Chasaide, Ailbhe",An exploration of voice source correlates of focus,Interspeech 2010,,10.21437/Interspeech.2010-198,https://www.isca-speech.org/archive/interspeech_2010/yanushevskaya10_interspeech.html,"This pilot study explores how the voice source parameters vary in focally accented syllables. It examines the dynamics of the voice source parameters in an all-voiced short declarative utterance in which the focus placement was varied. The voice source parameters F0, EE, UP, OQ, RG, RA, RK and RD were obtained through inverse filtering and subsequent parameterisation using the LF-model. The results suggest that the focally accented syllables are marked not only by increased F0 but also by boosted EE, RG and UP. The non-focal realisations show reduced values for the above parameters along with a tendency towards higher OQ values, suggesting a more lax mode of phonation.",26/09/2010,22/02/2023 10:36,22/02/2023 10:36,31/01/2023 08:26,462-465,ISCA,en,prosody,Interspeech 2010
2005,"You, Hong; Alwan, Abeer; Kazemzadeh, Abe; Narayanan, Shrikanth",Pronunciation variations of Spanish-accented English spoken by young children,Interspeech 2005,,10.21437/Interspeech.2005-349,https://www.isca-speech.org/archive/interspeech_2005/you05_interspeech.html,"When learning to speak English, non-native speakers may pronounce some English phonemes differently from native speakers. These pronunciation variations can degrade an automatic speech recognition system’s performance on accented English. This paper is a ﬁrst attempt to ﬁnd common pronunciation variations in Spanishaccented English as spoken by young children. The analysis of pronunciation variation is performed using dynamic programming-based transcription alignment on 4500 words spoken by children 5-7 years old whose ﬁrst language is Spanish. The ﬁndings are then compared with linguistic hypotheses.",04/09/2005,22/02/2023 10:36,07/03/2023 11:29,31/01/2023 08:26,749-752,ISCA,en,L2; not-tech; description-of-accent; production-study; accent-in-title,Interspeech 2005
2022,"Zhang, Yuanyuan; Zhang, Yixuan; Halpern, Bence; Patel, Tanvina; Scharenborg, Odette",Mitigating bias against non-native accents,Interspeech 2022,,10.21437/Interspeech.2022-836,https://www.isca-speech.org/archive/interspeech_2022/zhang22n_interspeech.html,"Automatic speech recognition (ASR) systems have seen substantial improvements in the past decade; however, not for all speaker groups. Recent research shows that bias exists against different types of speech, including non-native accents, in stateof-the-art (SOTA) ASR systems. To attain inclusive speech recognition, i.e., ASR for everyone irrespective of how one speaks or the accent one has, bias mitigation is necessary. Here we focus on bias mitigation against non-native accents using two different approaches: data augmentation and by using more effective training methods. We used an autoencoderbased cross-lingual voice conversion (VC) model to increase the amount of non-native accented speech training data in addition to data augmentation through speed perturbation. Moreover, we investigate two training methods, i.e., fine-tuning and domain adversarial training (DAT), to see whether they can use the limited non-native accented speech data more effectively than a standard training approach. Experimental results show that VCbased data augmentation successfully mitigates the bias against non-native accents for the SOTA end-to-end (E2E) Dutch ASR system. Combining VC and speed perturbed data gave the lowest word error rate (WER) and the smallest bias against nonnative accents. Fine-tuning and DAT reduced the bias against non-native accents but at the cost of native performance.",18/09/2022,22/02/2023 10:36,27/02/2023 07:53,31/01/2023 08:26,3168-3172,ISCA,en,ASR; L2; definition; some-description,Interspeech 2022
2011,"Zheng, Rong; Zhang, Ce; Xu, Bo",Data-driven UBM generation via tied Gaussians for GMM-supervector based accent identification,Interspeech 2011,,10.21437/Interspeech.2011-325,https://www.isca-speech.org/archive/interspeech_2011/zheng11b_interspeech.html,"This paper presents a new approach to exploit data-driven universal background model (UBM) generation using tied Gaussians for accent identification (AID). The motivation of the proposed algorithm is to potentially utilize broad phoneticspecific accent characteristics by Gaussian mixture model (GMM) and examine data-driven phonetically-inspired UBM creation for GMM-supervector based accent classification. In this work, we discuss the issues involved in applying cumulative posterior probability based Gaussian selection and tree structure based UBM parameter estimation. Derivation and validation of the UBM refined by tied Gaussians are reported in this paper. Performance evaluations comparing our system with other well-known techniques for AID are also provided. Better performance is further achieved by fusing these acoustic-based accent classifiers. Comparison experiments conducted on the CSLU foreign-accented English (FAE) dataset show the effectiveness of the proposed method.",27/08/2011,22/02/2023 10:36,22/02/2023 10:36,31/01/2023 08:26,845-848,ISCA,en,accent-identification,Interspeech 2011
2004,"Aalburg, Stefanie; Hoege, Harald",Foreign-accented speaker-independent speech recognition,Interspeech 2004,,10.21437/Interspeech.2004-558,https://www.isca-speech.org/archive/interspeech_2004/aalburg04_interspeech.html,"This research investigated whether acoustic-phonetic knowledge of the mother tongue of a non-native speaker can be used to adapt an existing target language phoneme HMM recognizer. For this purpose three sets of phoneme HMMs were generated, one representing the target language (German), one the mother tongue of the non-native speaker (Turkish), and the third the foreign-accented pronunciation of the target language (German spoken by Turkish speakers). The latter served as a benchmark for the tested adaptation methods. A derived Hidden Markov Model (HMM) clustering algorithm was applied on the target language phoneme HMM set using the mother tongue phoneme HMM set of the non-native speaker. Following the HMM adaptation a phoneme-level pronunciation technique was applied to generate phoneme mapping rules for the lexicon adaptation task. The results revealed a relative reduction of about 6% in WER for the adapted HMM. No further improvements were observed from the lexicon adaptation task.",04/10/2004,22/02/2023 10:36,26/02/2023 11:13,31/01/2023 08:26,1465-1468,ISCA,en,ASR; L2; some-description; foreign-accent,Interspeech 2004
2012,"Badino, Leonardo; Clark, Robert A. J.; Wester, Mirjam",Towards hierarchical prosodic prominence generation in TTS synthesis,Interspeech 2012,,10.21437/Interspeech.2012-628,https://www.isca-speech.org/archive/interspeech_2012/badino12_interspeech.html,"We address the problem of identiﬁcation (from text) and generation of pitch accents in HMM-based English TTS synthesis. We show, through a large scale perceptual test, that a large improvement of the binary discrimination between pitch accented and non-accented words has no effect on the quality of the speech generated by the system. On the other side adding a third accent type that emphatically marks words that convey ”contrastive” focus (automatically identiﬁed from text) produces beneﬁcial effects on the synthesized speech. These results support the accounts on prosodic prominence that consider the prosodic patterns of utterances as hierarchical structured and point out the limits of a ﬂattening of such structure resulting from a simple accent/non-accent distinction.",09/09/2012,22/02/2023 10:36,22/02/2023 10:36,31/01/2023 08:26,2398-2401,ISCA,en,prosody,Interspeech 2012
2013,"Cheng, Jian; Bojja, Nikhil; Chen, Xin",Automatic accent quantification of indian speakers of English,Interspeech 2013,,10.21437/Interspeech.2013-579,https://www.isca-speech.org/archive/interspeech_2013/cheng13_interspeech.html,"In addition to measuring job candidates spoken English proﬁciency, quantifying the degree of accentedness may help companies assign employees to appropriate job categories, or identify employees who could beneﬁt from additional speech training. In this paper, we discuss methods for automatic accent quantiﬁcation of Indian English speakers. Similar to techniques used in speaker recognition, we used Gaussian mixture models (GMMs) for the modeling of accent spectral characteristics in different groups of subjects. Computationally, we veriﬁed that certain consonants in Indian English have more discriminative power than others in quantifying an Indian accent. As a result, we propose the idea of using GMMs to model only certain phonemes with high predictive power. By combining features from GMMs with others, we achieved a human-machine correlation coefﬁcient of 0.84 at the participant level. The results validate the use of new proposed methods to quantify accents automatically.",25/08/2013,22/02/2023 10:36,07/03/2023 13:48,31/01/2023 08:26,2574-2578,ISCA,en,english; L2; accent-identification; linguistic-discrimination; perception-study; wrong-def; some-description; accentedness-rating; accent-in-title; lang-in-title; no-listener-description; no-speaker-description,Interspeech 2013
