Publication Year,Author,Title,Publication Title,ISBN,DOI,Url,Abstract Note,Date,Date Added,Date Modified,Access Date,Pages,Publisher,Language,Manual Tags,Conference Name
2012,"Ludusan, Bogdan; Ziegler, Stefan; Gravier, Guillaume",Integrating stress information in large vocabulary continuous speech recognition,Interspeech 2012,,10.21437/Interspeech.2012-507,https://www.isca-speech.org/archive/interspeech_2012/ludusan12_interspeech.html,"In this paper we propose a novel method for integrating stress information in the decoding step of a speech recognizer. A multiscale rhythm model was used to determine the stress scores for each syllable, which are further used to reinforce paths during search. Two strategies for integrating the stress were employed: the ﬁrst one reinforces paths through all the syllables with a value proportional to the their stress score, while the second one enhances paths passing only through stressed syllables, but with a constant value. The former strategy slightly outperforms the later, bringing a relative improvement of more than 2% over the baseline. Furthermore, the stress information proved to be a robust feature, by performing well even for foreign-accented speech.",09/09/2012,22/02/2023 10:34,22/02/2023 10:34,06/02/2023 15:19,2642-2645,ISCA,en,prosody,Interspeech 2012
2017,"Lundmark, Malin Svensson; Ambrazaitis, Gilbert; Ewald, Otto",Exploring Multidimensionality: Acoustic and Articulatory Correlates of Swedish Word Accents,Interspeech 2017,,10.21437/Interspeech.2017-1502,https://www.isca-speech.org/archive/interspeech_2017/lundmark17_interspeech.html,This study investigates acoustic and articulatory correlates of South Swedish word accents (Accent 1 vs. 2) – a tonal distinction traditionally associated with F0 timing. The study is motivated by previous findings on (i) the acoustic complexity of tonal prosody and (ii) tonal-articulatory interplay in other languages.,20/08/2017,22/02/2023 10:34,22/02/2023 10:34,06/02/2023 15:19,3236-3240,ISCA,en,prosody,Interspeech 2017
2017,"Luo, Dean; Luo, Ruxin; Wang, Lixin",Prosody Analysis of L2 English for Naturalness Evaluation Through Speech Modification,Interspeech 2017,,10.21437/Interspeech.2017-332,https://www.isca-speech.org/archive/interspeech_2017/luo17b_interspeech.html,"This study investigates how different prosodic features affect native speakers' naturalness judgement of L2 English speech by Chinese students. Through subjective judgment by native speakers and objectively measured prosodic features, timing and pitch related prosodic features, as well as segmental goodness of pronunciation have been found to play key roles in native speakers' perception of naturalness. In order to eliminate segmental factors, we used accent conversion techniques that modify native reference speech with learners' erroneous prosodic cues without altering segmental properties. Experimental results show that without interference of segmental factors, both timing and pitch features affect naturalness of L2 speech. Timing plays a more crucial role in naturalness than pitch. Accent modification that corrects timing or pitch errors can improve naturalness of the speech.",20/08/2017,22/02/2023 10:34,22/02/2023 10:34,06/02/2023 15:19,1775-1778,ISCA,en,prosody,Interspeech 2017
2018,"Luong, Hieu-Thi; Wang, Xin; Yamagishi, Junichi; Nishizawa, Nobuyuki",Investigating Accuracy of Pitch-accent Annotations in Neural Network-based Speech Synthesis and Denoising Effects,Interspeech 2018,,10.21437/Interspeech.2018-1227,https://www.isca-speech.org/archive/interspeech_2018/luong18_interspeech.html,"We investigated the impact of noisy linguistic features on the performance of a Japanese speech synthesis system based on neural network that uses WaveNet vocoder. We compared an ideal system that uses manually corrected linguistic features including phoneme and prosodic information in training and test sets against a few other systems that use corrupted linguistic features. Both subjective and objective results demonstrate that corrupted linguistic features, especially those in the test set, affected the ideal system’s performance signiﬁcantly in a statistical sense due to a mismatched condition between the training and test sets. Interestingly, while an utterance-level Turing test showed that listeners had a difﬁcult time differentiating synthetic speech from natural speech, it further indicated that adding noise to the linguistic features in the training set can partially reduce the effect of the mismatch, regularize the model, and help the system perform better when linguistic features of the test set are noisy.",02/09/2018,22/02/2023 10:34,22/02/2023 10:34,06/02/2023 15:20,37-41,ISCA,en,prosody,Interspeech 2018
2017,"Maastricht, Lieke van; Zee, Tim; Krahmer, Emiel; Swerts, Marc","L1 Perceptions of L2 Prosody: The Interplay Between Intonation, Rhythm, and Speech Rate and Their Contribution to Accentedness and Comprehensibility",Interspeech 2017,,10.21437/Interspeech.2017-1150,https://www.isca-speech.org/archive/interspeech_2017/maastricht17_interspeech.html,"This study investigates the cumulative effect of (non-)native intonation, rhythm, and speech rate in utterances produced by Spanish learners of Dutch on Dutch native listeners’ perceptions. In order to assess the relative contribution of these language-specific properties to perceived accentedness and comprehensibility, speech produced by Spanish learners of Dutch was manipulated using transplantation and resynthesis techniques. Thus, eight manipulation conditions reflecting all possible combinations of L1 and L2 intonation, rhythm, and speech rate were created, resulting in 320 utterances that were rated by 50 Dutch natives on their degree of foreign accent and ease of comprehensibility.",20/08/2017,22/02/2023 10:34,22/02/2023 10:34,06/02/2023 15:20,364-368,ISCA,en,prosody,Interspeech 2017
2015,"Mády, Katalin","Prosodic (non-)realisation of broad, narrow and contrastive focus in Hungarian: a production and a perception study",Interspeech 2015,,10.21437/Interspeech.2015-18,https://www.isca-speech.org/archive/interspeech_2015/mady15_interspeech.html,"In languages with variable focus positions, prominent elements tend to be emphasised by prosodic cues (e.g. English). If a language prefers a given prosodic pattern, i.e. sentence-ﬁnal nuclear accents, like Spanish, the prosodic realisation of broad focus might not differ from that of narrow and contrastive focus. The relevance of prosodic focus marking was tested in Hungarian were focus typically appears in front of the ﬁnite verb. Prosodic cues such as f0 maximum, f0 peak alignment, segment duration and post-verbal deaccentuation were tested in an experiment with read question and answer sequences. While narrow and contrastive focus triggered post-verbal deaccentuation, none of the gradual measures distinguished focus types consistently from each other. A subsequent perception experiment was conducted in which the same sentences without postverbal units were to be judged for their naturalness. F0 maximum, f0 peak alignment and accent duration were manipulated. Naturalness scores revealed a sequence narrow > contrastive > broad focus, i.e. a preference for narrow focus contexts compared to contrastive and broad focus ones, while the manipulated prosodic parameters had no effect on the scores. It is concluded that prosodic focus marking in Hungarian is optional and pragmatic rather than grammatical and syntax-related.",06/09/2015,22/02/2023 10:34,22/02/2023 10:34,06/02/2023 15:20,948-952,ISCA,en,prosody,Interspeech 2015
2017,"Maekawa, Kikuo",A New Model of Final Lowering in Spontaneous Monologue,Interspeech 2017,,10.21437/Interspeech.2017-175,https://www.isca-speech.org/archive/interspeech_2017/maekawa17_interspeech.html,"F0 downtrend observed in spontaneous monologues in the Corpus of Spontaneous Japanese was analyzed with special attention to the modeling of final lowering. In addition to the previous finding that the domain of final lowering covers all tones in the final accentual phrase, it turned out that the last L tone in the penultimate accentual phrase played important role in the control of final lowering. It is this tone that first reached the bottom of the speaker’s pitch range in the time course of utterance; it also turned out that the phonetic realization of this tone is the most stable of all tones in terms of the F0 variability. Regression model of F0 downtrends is generated by generalized linear mixed-effect modeling and evaluated by cross-validation. The mean prediction error of z-normalized F0 values in the best model was 0.25 standard deviation.",20/08/2017,22/02/2023 10:34,22/02/2023 10:34,06/02/2023 15:20,1233-1237,ISCA,en,prosody,Interspeech 2017
2007,"Martinović, Miroslav; Vesić, Srdjan; Rakić, Goran",Building an information retrieval system for serbian - challenges and solutions,Interspeech 2007,,10.21437/Interspeech.2007-437,https://www.isca-speech.org/archive/interspeech_2007/martinovic07_interspeech.html,"We describe challenges encountered while building an information retrieval system for Serbian language. Approaches designed and adopted to handle them are depicted and illuminated in this paper. As a backbone of our system, we used SMART retrieval system which we augmented with features necessary to deal with specificities of the Serbian alphabet. In addition, morphological richness of the language accentuated implications of the text preprocessing phase. During this phase, we devised two algorithms which increased retrieval precision by 14% and 27%, respectively. Testing was conducted using two gigabyte EBART collection of Serbian newspaper articles.",27/08/2007,22/02/2023 10:34,22/02/2023 10:34,06/02/2023 15:20,1513-1516,ISCA,en,not-accent,Interspeech 2007
2012,"Mehrabani, Mahnoosh; Tepperman, Joseph; Nava, Emily",Nativeness classification with suprasegmental features on the accent group level,Interspeech 2012,,10.21437/Interspeech.2012-553,https://www.isca-speech.org/archive/interspeech_2012/mehrabani12_interspeech.html,"We present a novel approach to discriminating native and nonnative utterances based on suprasegmental features extracted at the Accent Group (AG) level. Past studies have shown modeling a set of shared intonation patterns across AGs to be effective in predicting local f0 contour shapes. Here we demonstrate that AG level prosodic features are also effective in nativeness classiﬁcation. The proposed suprasegmental feature set is very low dimensional, and is derived from f0 and energy contours across the AG, as well as normalized duration of the syllables within each AG. A Random Forest back end classiﬁer is used to combine AG level scores from GMM and Decision Tree models, producing nativeness scores at the utterance level. The proposed prosodic nativeness classiﬁer achieves 83.3% accuracy for 2-AG utterances and 89.1% accuracy for 3-AG utterances, exceeding a baseline Gaussian Supervector system’s performance by more than 10% absolute. The vastly lower dimensionality of the proposed feature set relative to the baseline method suggests the importance of suprasegmental features over traditional spectral cues in contributing to the perceived nativeness of a learner’s language.",09/09/2012,22/02/2023 10:34,22/02/2023 10:34,06/02/2023 15:20,2073-2076,ISCA,en,L2,Interspeech 2012
2019,"Mendes, Carlos; Abad, Alberto; Neto, João Paulo; Trancoso, Isabel",Recognition of Latin American Spanish Using Multi-Task Learning,Interspeech 2019,,10.21437/Interspeech.2019-2772,https://www.isca-speech.org/archive/interspeech_2019/mendes19_interspeech.html,"In the broadcast news domain, national wide newscasters typically interact with communities with a diverse set of accents. One of the challenges in speech recognition is the performance degradation in the presence of these diverse conditions. Performance further aggravates when the accents are from other countries that share the same language. Extensive work has been conducted in this topic for languages such as English and Mandarin. Recently, TDNN based multi-task learning has received some attention in this area, with interesting results, typically using models trained with a variety of different accented corpora from a particular language. In this work, we look at the case of LATAM (Latin American) Spanish for its unique and distinctive accent variations. Because LATAM Spanish has historically been inﬂuenced by non-Spanish European migrations, we anticipated that LATAM based speech recognition performance can be further improved by including these inﬂuential languages, during a TDNN based multi-task training. Experiments show that including such languages in the training setup outperforms the single task acoustic model baseline. We also propose an automatic per-language weight selection strategy to regularize each language contribution during multi-task training.",15/09/2019,22/02/2023 10:34,22/02/2023 10:34,06/02/2023 15:20,2135-2139,ISCA,en,L1,Interspeech 2019
2011,"Michelas, Amandine; Nguyen, Noël",Uncovering the effect of imitation on tonal patterns of French accentual phrases,Interspeech 2011,,10.21437/Interspeech.2011-396,https://www.isca-speech.org/archive/interspeech_2011/michelas11_interspeech.html,"French accentual phrases (APs) are characterized by the presence of a typical final fo rise (LH*) and an optional/additional initial fo rise (LHi). This study tested whether between-speaker speech imitation influenced the realization of APs tonal patterns. The experiment was based on APs containing a function word plus a bisyllabic content word, whose tonal patterns differed in the potential placement of an optional/initial high tone (Hi). In two shadowing tasks (without/with explicit instructions to imitate the speaker’s way of pronouncing the stimuli), participants produced more initial high tones when they heard a stimulus including both initial and final high tones relative to stimuli which only a final high tone was present. Thus, imitation influences the realization of APs tonal patterns in French.",27/08/2011,22/02/2023 10:34,22/02/2023 10:34,06/02/2023 15:20,973-976,ISCA,en,prosody,Interspeech 2011
2013,"Michelas, Amandine; Portes, Cristel; Champagne-Lavau, Maud",Intonational contrasts encode speaker's certainty in neutral vs. incredulity declarative questions in French,Interspeech 2013,,10.21437/Interspeech.2013-227,https://www.isca-speech.org/archive/interspeech_2013/michelas13_interspeech.html,"While recent crosslinguistic studies have shown that the degree of speaker’s commitment or certainty is encoded intonationally either in a gradient or categorical fashion, our understanding of how French speakers use Intonational-Phrase (IP) final contours to signal their degree of certainty is limited. This paper investigates the contribution of a penultimate peak contour in French to convey speakers’ uncertainty. Participants read target sentences in a neutral vs. incredulity declarative question context. Prosodic annotation revealed that incredulity declarative questions consistently exhibited the presence of an additional f0 peak in the penultimate syllable of the IP which was unaccented. The acoustic analyses showed that the H tone of the unaccented penultimate peak was not downstepped and thus approximately scaled to the same height of the last pitch accent. The findings of this study provide the first quantitative description of a phonological contrast between H*H% and H+ H*H% to signal speakers’ certainty in declarative questions in French.",25/08/2013,22/02/2023 10:34,22/02/2023 10:34,06/02/2023 15:20,783-787,ISCA,en,prosody,Interspeech 2013
2020,"Michelas, Amandine; Dufour, Sophie",Does French Listeners’ Ability to Use Accentual Information at the Word Level Depend on the Ear of Presentation?,Interspeech 2020,,10.21437/Interspeech.2020-1263,https://www.isca-speech.org/archive/interspeech_2020/michelas20_interspeech.html,"In two long-term repetition priming experiments, we investigated how accentual information is processed and represented in the French listeners’ mind. Repeated prime and target words either matched (/b 'do/ - / b 'do/ ‘headband’) or mismatched in their accentual patterns (/b do/ - /b 'do/). In experiment 1, the target words were presented in the left ear only, and attenuation in the repetition priming effect was observed when the primes and the targets mismatched in their accentual pattern. The differential priming effect between match and mismatch primes was no longer observed in Experiment 2 when the targets were presented in the right ear only. Together, these results showed that accentual variation at the word level in French is treated as related-talker variation, and only influences word recognition under specific circumstances, in particular, when we push word processing in the right hemisphere.",25/10/2020,22/02/2023 10:34,22/02/2023 10:34,06/02/2023 15:20,1615-1619,ISCA,en,prosody,Interspeech 2020
2011,"Minematsu, Nobuaki; Okabe, Koji; Ogaki, Keisuke; Hirose, Keikichi",Measurement of objective intelligibility of Japanese accented English using ERJ (English read by Japanese) database,Interspeech 2011,,10.21437/Interspeech.2011-310,https://www.isca-speech.org/archive/interspeech_2011/minematsu11_interspeech.html,"In many schools, English is taught as international communication tool and the goal of English pronunciation training is generally to acquire intelligible enough pronunciation, which is not always native-sounding pronunciation. However, the deﬁnition of the intelligible pronunciation is not easy because it depends on the speaking skill of a speaker, the predictability of a content, and the language background of a listener. One kind of accented pronunciation, which is intelligible enough for some listeners, is often less intelligible for others. This paper focuses on objective intelligibility of Japanese English through the ears of American English speakers with little exposure to Japanese English. A large listening test was conducted using ERJ (English Read by Japanese) database. A balanced subset of this database were presented over a telephone line to the American listeners who were asked to repeat what they heard. Totally, 17,416 repetitive responses were collected and they were transcribed manually. This paper describes the design of this experiment and some results of analyzing the results of transcription.",27/08/2011,22/02/2023 10:34,22/02/2023 10:34,06/02/2023 15:20,1481-1484,ISCA,en,L2,Interspeech 2011
2012,"Minematsu, Nobuaki; Kobayashi, Shumpei; Shimizu, Shinya; Hirose, Keikichi",Improved prediction of Japanese word accent sandhi using CRF,Interspeech 2012,,10.21437/Interspeech.2012-663,https://www.isca-speech.org/archive/interspeech_2012/minematsu12_interspeech.html,"In Japanese, every content word has its own mora-based H/L pitch pattern when it is uttered in isolation, called accent type. When reading out a written sentence, however, this lexical H/L pattern is often changed according to the context, known as word accent sandhi. In our previous work, an accent sandhi predictor was developed using CRF [1], and in this paper, the predictor is improved through feature engineering especially focusing on phrases including numerals and those including loanwords. This is because our previous work showed that the prediction performance was relatively low for those phrases. To optimize the features used for CRF, it is critical to take into account the mechanism of word accent sandhi. We review linguistic and technical literature that attempted to characterize accent sandhi in the phrases including numerals and loanwords and, by reﬂecting these characteristics, the features are re-designed. Experiments show that the proposed predictor improved the performance relatively by 37% and 41%, respectively.",09/09/2012,22/02/2023 10:34,22/02/2023 10:34,06/02/2023 15:20,2562-2565,ISCA,en,prosody,Interspeech 2012
2009,"Mixdorff, Hansjörg; Pfitzinger, Hartmut R.",A quantitative study of F0 peak alignment and sentence modality,Interspeech 2009,,10.21437/Interspeech.2009-297,https://www.isca-speech.org/archive/interspeech_2009/mixdorff09_interspeech.html,"The current study examines the relationship between prosodic accent labels assigned in the Kiel Corpus of Spontaneous Speech IV, Isačenko’s intoneme classes of the underlying accents and the associated parameters of the Fujisaki model. Among other findings, there is a close connection between early peaks and information intonemes, as well as late peaks and non-terminal intonemes. The majority of tokens within both intoneme classes, however, are associated with medial peaks. Precise analysis of alignment shows that accent command offset times for information intonemes are significantly earlier than for non-terminal intonemes. This suggests that the anchoring of the relevant tonal transition could be more important for separating different intonational categories than that of the F0 peak.",06/09/2009,22/02/2023 10:34,22/02/2023 10:34,06/02/2023 15:20,1003-1006,ISCA,en,prosody,Interspeech 2009
2009,"Mixdorff, Hansjörg; Ingram, John",Prosodic analysis of foreign-accented English,Interspeech 2009,,10.21437/Interspeech.2009-666,https://www.isca-speech.org/archive/interspeech_2009/mixdorff09b_interspeech.html,"This study compares utterances by Vietnamese learners of Australian English with those of native subjects. In a previous study the utterances had been rated for foreign accent and intelligibility. We aim to find measurable prosodic differences accounting for the perceptual results. Our outcomes indicate, inter alia, that unaccented syllables are relatively longer compared with accented ones in the Vietnamese corpus than those in the Australian English corpus. Furthermore, the correlations of syllabic durations in utterances of one and the same sentence are much higher for Australian English subjects than for Vietnamese learners of English. Vietnamese speakers use a larger range of f0 and produce more pitch-accents than Australian speakers.",06/09/2009,22/02/2023 10:34,22/02/2023 10:34,06/02/2023 15:20,2527-2530,ISCA,en,L2,Interspeech 2009
2013,"Mixdorff, Hansjörg; Niebuhr, Oliver",The influence of F0 contour continuity on prominence perception,Interspeech 2013,,10.21437/Interspeech.2013-73,https://www.isca-speech.org/archive/interspeech_2013/mixdorff13_interspeech.html,"The presented study concerns the influence of the syllabic structure on perceived prominence. We examined how gaps in the F0 contour due to unvoiced consonants affect prominence perception, given that such gaps can either be filled or blinded out by listeners. For this purpose we created a stimulus set of real disyllabic words which differed in the quantity of the vowel of the accented syllable nucleus and the types of subsequent intervocalic consonant(s). Results include, inter alia, that stimuli with unvoiced gaps in the F0 contour are indeed perceived as less prominent. The prominence reduction is smaller for monotonous stimuli than for stimuli with F0 excursions across the accented syllable. Moreover, in combination with F0 excursions, it also mattered whether F0 had to be interpolated or extrapolated, and whether or not the gap included a fricative sound. The results support both the filling-in and blinding-out of F0 gaps, which fits in well with earlier experiments on the production and perception of pitch.",25/08/2013,22/02/2023 10:34,22/02/2023 10:34,06/02/2023 15:20,230-234,ISCA,en,prosody,Interspeech 2013
2015,"Montacié, Claude; Caraty, Marie-José",Phrase accentuation verification and phonetic variation measurement for the degree of nativeness sub-challenge,Interspeech 2015,,10.21437/Interspeech.2015-180,https://www.isca-speech.org/archive/interspeech_2015/montacie15_interspeech.html,"The Degree of Nativeness Sub-Challenge consists in the automatic grading of the pronunciation quality of non-native English utterances. In this paper, we investigate the phrase accentuation and the phonetic acoustic variability for the prediction of the grades. Two prediction systems have been developed: the Extended Baseline System (EBS) and the Pronunciation Feature based System (PFS). The EBS system was designed to take into account the cross-corpus specificities such as recording conditions and the sentence variability. The speech files were segmented using Automatic Speech Recognition methods (ASR). Audio features were selected on both the training and development sets using the Regressional ReliefF method. New audio features were developed for the PFS system to take into account the mispronunciations: unusual prosody and/or phonetic variation. These systems have been assessed using the Spearman’s correlation coefficient with expert annotations. The PFS system has significantly improved of 0.05 the Official Baseline performance.",06/09/2015,22/02/2023 10:34,22/02/2023 10:34,06/02/2023 15:20,483-487,ISCA,en,prosody,Interspeech 2015
2005,"Mori, Laura; Barkat-Defradas, Melissa",Acoustic properties of foreign accent: VOT variations in Moroccan-accented Italian,Interspeech 2005,,10.21437/Interspeech.2005-768,https://www.isca-speech.org/archive/interspeech_2005/mori05b_interspeech.html,"The present study investigates the temporal parameter of VOT from a cross-language perspective, as far as native Moroccan, native Italian and Moroccanaccented Italian are concerned. The comparative analysis carried out underlines a language effect on the VOT duration across the three language varieties.",04/09/2005,22/02/2023 10:34,22/02/2023 10:34,06/02/2023 15:20,2909-2912,ISCA,en,L2,Interspeech 2005
