Publication Year,Author,Title,Publication Title,ISBN,DOI,Url,Abstract Note,Date,Date Added,Date Modified,Access Date,Pages,Publisher,Language,Manual Tags,Conference Name
2020,"Shirahata, Yuma; Saito, Daisuke; Minematsu, Nobuaki",Discriminative Method to Extract Coarse Prosodic Structure and its Application for Statistical Phrase/Accent Command Estimation,Interspeech 2020,,10.21437/Interspeech.2020-2566,https://www.isca-speech.org/archive/interspeech_2020/shirahata20_interspeech.html,"This paper introduces a method of extracting coarse prosodic structure from fundamental frequency (F0) contours by using a discriminative approach such as deep neural networks (DNN), and applies the method for the parameter estimation of the Fujisaki model. In the conventional methods for the parameter estimation of the Fujisaki model, generative approaches, in which the estimation is treated as an inverse problem of the generation process, have been adopted. On the other hand, recent development of the discriminative approaches would enable us to treat the problem in a direct manner. To introduce a discriminative approach to the parameter estimation of the Fujisaki model in which the precise labels for the parameter are expensive, this study focuses on the similarities between the acoustic realization of the prosodic structure in F0 contours and the sentence structure of the read text. In the proposed method, the sentence structure obtained from the text is utilized as the labels for the discriminative model, and the model estimates the coarse prosodic structure. Finally this structure is reﬁned by using a conventional method for the parameter estimation. Experimental results demonstrate that the proposed method improves the estimation accuracy by 18% in terms of detection rate without using any auxiliary features at inference.",25/10/2020,22/02/2023 10:34,22/02/2023 10:34,06/02/2023 15:23,4427-4431,ISCA,en,prosody,Interspeech 2020
2019,"Shor, Joel; Emanuel, Dotan; Lang, Oran; Tuval, Omry; Brenner, Michael; Cattiau, Julie; Vieira, Fernando; McNally, Maeve; Charbonneau, Taylor; Nollstadt, Melissa; Hassidim, Avinatan; Matias, Yossi",Personalizing ASR for Dysarthric and Accented Speech with Limited Data,Interspeech 2019,,10.21437/Interspeech.2019-1427,https://www.isca-speech.org/archive/interspeech_2019/shor19_interspeech.html,"Automatic speech recognition (ASR) systems have dramatically improved over the last few years. ASR systems are most often trained from ‘typical’ speech, which means that underrepresented groups don’t experience the same level of improvement. In this paper, we present and evaluate ﬁnetuning techniques to improve ASR for users with non-standard speech. We focus on two types of non-standard speech: speech from people with amyotrophic lateral sclerosis (ALS) and accented speech. We train personalized models that achieve 62% and 35% relative WER improvement on these two groups, bringing the absolute WER for ALS speakers, on a test set of message bank phrases, down to 10% for mild dysarthria and 20% for more serious dysarthria. We show that 71% of the improvement comes from only 5 minutes of training data. Finetuning a particular subset of layers (with many fewer parameters) often gives better results than ﬁnetuning the entire model. This is the ﬁrst step towards building state of the art ASR models for dysarthric speech.",15/09/2019,22/02/2023 10:34,22/02/2023 10:34,06/02/2023 15:23,784-788,ISCA,en,L1-or-L2,Interspeech 2019
2007,"Shue, Yen-Liang; Iseli, Markus; Veilleux, Nanette; Alwan, Abeer",Pitch accent versus lexical stress: quantifying acoustic measures related to the voice source,Interspeech 2007,,10.21437/Interspeech.2007-690,https://www.isca-speech.org/archive/interspeech_2007/shue07_interspeech.html,"In this paper, we explore acoustic correlates of pitch accent and main lexical stress in American English, and the interaction of these cues with other factors that affect prosody. In a controlled study, we varied presence or absence and type of pitch accent (L∗ vs H∗), boundary-related tone sequence (L-L% vs. HH%) and gender of the talker, for the sentence “Dagada gave Bobby doodads”. The measures were duration, F0 (fundamental frequency), H1∗−H2∗ (related to open quotient), and H1∗−A∗3 (related to spectral tilt). Contour approximations were used to analyze time-course movements of these measures. For “Dagada” we found that, consistent with earlier literature, a) H∗ and L∗ pitch accents showed different F0 contours, b) pitchaccented syllables were longer than unaccented ones, c) stressed “ga” syllables had lower H1∗ − H2∗ values than surrounding unstressed syllables, and for male talkers, lower H1∗ − A∗3 values, indicating lesser spectral tilt. Unexpectedly, F0 maxima associated with an H∗ accent occurred most of the time later in the accented syllable than F0 minima associated with L∗. The cues to lexical stress were consistent with or without pitch accent (e.g. lower H1∗ − H2∗), but they sometimes interacted with gender and/or boundary tones: for example, lower H1∗ − A∗3 in stressed “ga” syllables was only found for female talkers in unaccented cases, and some cues of both accent and stress were less pronounced in the ﬁnal word “doodads”, which also carried boundary-related tones.",27/08/2007,22/02/2023 10:34,22/02/2023 10:34,06/02/2023 15:23,2625-2628,ISCA,en,prosody,Interspeech 2007
2008,"Shue, Yen-Liang; Shattuck-Hufnagel, Stefanie; Iseli, Markus; Jun, Sun-Ah; Veilleux, Nanette; Alwan, Abeer",Effects of intonational phrase boundaries on pitch-accented syllables in american English,Interspeech 2008,,10.21437/Interspeech.2008-279,https://www.isca-speech.org/archive/interspeech_2008/shue08_interspeech.html,"Recent studies of the acoustic correlates of various prosodic elements in American English, such as prominence (in the form of phrase-level pitch accents and word-level lexical stress) and boundaries (in the form of boundary-marking tones), have begun to clarify the nature of the acoustic cues to different types and levels of these prosodic markers. This study focuses on the importance of controlling for context in such investigations, illustrating the effects of adjacent context by examining the cues to H* and L* pitch accent in early and late position in the Intonational Phrase, and how these cues vary when the accented syllable is followed immediately by boundary tones. Results show that F0 peaks for H* accents occur significantly earlier in words that also carry boundary tones, and that energy patterns are also affected; some effects on voice quality measures were also noted. Such findings highlight the caveat that the context of a particular prosodic target may significantly influence its acoustic correlates.",22/09/2008,22/02/2023 10:34,22/02/2023 10:34,06/02/2023 15:23,873-876,ISCA,en,prosody,Interspeech 2008
2013,"Siddins, Jessica; Harrington, Jonathan; Kleber, Felicitas; Reubold, Ulrich",The influence of accentuation and polysyllabicity on compensatory shortening in German,Interspeech 2013,,10.21437/Interspeech.2013-177,https://www.isca-speech.org/archive/interspeech_2013/siddins13_interspeech.html,"The aim of this study was to investigate the relationship between compensatory shortening and coarticulation in German tense and lax vowels in trochees and iambs and to determine whether this relationship was inﬂuenced by prosodic accentuation. Speakers produced near minimal pairs differing in vowel tensity in monosyllabic and disyllabic words (both trochees and iambs) in accented and deaccented contexts. We found signiﬁcant effects of polysyllabic shortening, but only in tense vowels of nuclear-accented target words. Both stress patterns (trochaic and iambic) showed equal effects of polysyllabic shortening. Thus, while the duration of tense vowels in this study depended on accentuation and syllabicity, perhaps in order to provide perceptual cues for the listener, lax vowels were immune from lengthening and shortening phenomena. As a result, the durational difference between tense and lax vowels appears to lessen in prosodically weak contexts. The greater overlap of acoustic duration in deaccented contexts may contribute to the origin of the diachronic merger of tense and lax vowels in some languages.",25/08/2013,22/02/2023 10:34,22/02/2023 10:34,06/02/2023 15:23,1002-1006,ISCA,en,prosody,Interspeech 2013
2017,"Sivaraman, Ganesh; Espy-Wilson, Carol; Wieling, Martijn",Analysis of Acoustic-to-Articulatory Speech Inversion Across Different Accents and Languages,Interspeech 2017,,10.21437/Interspeech.2017-260,https://www.isca-speech.org/archive/interspeech_2017/sivaraman17_interspeech.html,"The focus of this paper is estimating articulatory movements of the tongue and lips from acoustic speech data. While there are several potential applications of such a method in speech therapy and pronunciation training, performance of such acoustic-to-articulatory inversion systems is not very high due to limited availability of simultaneous acoustic and articulatory data, substantial speaker variability, and variable methods of data collection. This paper therefore evaluates the impact of speaker, language and accent variability on the performance of an acoustic-to-articulatory speech inversion system. The articulatory dataset used in this study consists of 21 Dutch speakers reading Dutch and English words and sentences, and 22 UK English speakers reading English words and sentences. We trained several acoustic-to-articulatory speech inversion systems both based on deep and shallow neural network architectures in order to estimate electromagnetic articulography (EMA) sensor positions, as well as vocal tract variables (TVs). Our results show that with appropriate feature and target normalization, a speaker-independent speech inversion system trained on data from one language is able to estimate sensor positions (or TVs) for the same language correlating at about r = 0.53 with the actual sensor positions (or TVs). Cross-language results show a reduced performance of r = 0.47.",20/08/2017,22/02/2023 10:34,22/02/2023 10:34,06/02/2023 15:23,974-978,ISCA,en,L2,Interspeech 2017
2006,"Speyer, Augustin",Pauses as a tool to ensure rhythmic wellformedness,Interspeech 2006,,10.21437/Interspeech.2006-256,https://www.isca-speech.org/archive/interspeech_2006/speyer06_interspeech.html,"Rhythmic wellformedness on the level of syllables and words and the mechanisms which are employed to ensure it are well known and researched on. The level of sentential accent is less often in the focus of such studies. In this paper I argue that rhythmic wellformedness plays an equally important role on the sentential level and that the preferred strategy to ensure it is the insertion of a pause (or lengthening of an already present pause), rather than the classical strategies of stress shift and destressing. This has to do with the role that focal accent plays for the semantic interpretation of an utterance. A reading experiment showed clearly that in clash cases the distance between the words in clash is increased by a pause; as we get the same effect in words in which a number of unstressed syllables intervenes between the clashing focal accents, it is clear that it is not simply stress clash resolution but resolution of a clash on a higher level of representation.",17/09/2006,22/02/2023 10:34,22/02/2023 10:34,06/02/2023 15:23,paper 1406-Tue3A3O.2-0,ISCA,en,prosody,Interspeech 2006
2020,"Spinu, Laura; Hwang, Jiwon; Pincus, Nadya; Vasilita, Mariana",Exploring the Use of an Artificial Accent of English to Assess Phonetic Learning in Monolingual and Bilingual Speakers,Interspeech 2020,,10.21437/Interspeech.2020-2783,https://www.isca-speech.org/archive/interspeech_2020/spinu20_interspeech.html,"We designed a production experiment to explore the relatively controversial phenomenon of the bilingual advantage. Our focus is on an understudied aspect of bilingual cognition, speciﬁcally phonetic learning. We presented 36 participants (17 monolinguals and 19 early bilinguals) living in New York City with an artiﬁcially constructed accent of English, differing in four ways from Standard American English. More precisely, the novel accent included a vocalic change (diphthongization of the open-mid front unrounded vowel), consonantal change (tapping of intervocalic liquids), syllable structure change (epenthesis in voiceless s-clusters) and suprasegmental change (a novel intonation pattern in tag questions). After recording their baseline accents, the participants ﬁrst completed a training task, in which they listened to and then directly imitated sentences heard in the novel accent, and then a testing task, in which they were asked to read the baseline sentences in the accent they had just learned in the absence of any audio prompts. In this paper, we present acoustic results with diphthongization and tag question intonation. Our ﬁndings replicate the previously observed bilingual advantage in phonetic learning across the board and extend it to novel learning circumstances.",25/10/2020,22/02/2023 10:34,22/02/2023 10:34,06/02/2023 15:23,2377-2381,ISCA,en,L1-or-L2,Interspeech 2020
2008,"Sridhar, Vivek Kumar Rangarajan; Bangalore, Srinivas; Narayanan, Shrikanth S.",Factored translation models for enriching spoken language translation with prosody,Interspeech 2008,,10.21437/Interspeech.2008-675,https://www.isca-speech.org/archive/interspeech_2008/sridhar08_interspeech.html,"Key contextual information such as word prominence, emphasis, and contrast is typically ignored in speech-to-speech (S2S) translation due to the compartmentalized nature of the translation process. Conventional S2S systems rely on extracting prosody dependent cues from hypothesized (possibly erroneous) translation output using only words and syntax. In contrast, we propose the use of factored translation models to integrate the assignment and transfer of pitch accents (tonal prominence) during translation. We report experiments on 2 parallel corpora (Farsi-English and Japanese-English). The proposed factored translation models provide a relative improvement of 8.4% and 16.8% in pitch accent labeling accuracy over the postprocessing approach for the two corpora respectively.",22/09/2008,22/02/2023 10:34,22/02/2023 10:34,06/02/2023 15:23,2723-2726,ISCA,en,prosody,Interspeech 2008
2016,"Stehwien, Sabrina; Vu, Ngoc Thang",Exploring the Correlation of Pitch Accents and Semantic Slots for Spoken Language Understanding,Interspeech 2016,,10.21437/Interspeech.2016-511,https://www.isca-speech.org/archive/interspeech_2016/stehwien16_interspeech.html,"We investigate the correlation between pitch accents and semantic slots in human-machine speech. Using an automatic pitch accent detector on the ATIS corpus, we ﬁnd that most words labelled with semantic slots also carry a pitch accent. Most of the pitch accented words that are not associated with a semantic label are still meaningful, pointing towards the speaker’s intention. Our ﬁndings show that prosody constitutes a relevant and useful resource for spoken language understanding, especially considering the fact that our pitch accent detector does not require any kind of manual transcriptions during testing time.",08/09/2016,22/02/2023 10:34,22/02/2023 10:34,06/02/2023 15:23,730-734,ISCA,en,prosody,Interspeech 2016
2014,"Stringer, Louise; Iverson, Paul",The effect of regional and non-native accents on word recognition processes: a comparison of EEG responses in quiet to speech recognition in noise,Interspeech 2014,,10.21437/Interspeech.2014-555,https://www.isca-speech.org/archive/interspeech_2014/stringer14_interspeech.html,"Previous work has shown that both the speed and accuracy of word recognition can be reduced if a talker has a regional or non-native accent, particularly under noisy conditions. This study investigated whether the reduced intelligibility of some accents in noise are related to aspects of speech processing in quiet. Our goal was to see if difficulties processing accented speech under adverse listening conditions can be revealed in quiet using electrophysiological methods. Participants heard English sentences in a standard, regional or non-native accent. Behavioural measures found listeners had a strong intelligibility advantage for the standard accent when mixed with noise, replicating previous work. However, differences in processing the accents were less clear using the EEG measures. We found a significant Phonological Mapping Negativity (PMN) elicited by phonological anomalies, as well as an N400 effect, which is related to semantic anomalies, but although both responses were somewhat larger for the standard accent, there was more overlap in the EEG responses for different accents than for speech-in-noise recognition. More work is needed, but it is plausible that some of the difficulty that listeners have with accents under noise may be related to the same accent processing difficulties that occur in quiet.",14/09/2014,22/02/2023 10:34,22/02/2023 10:34,06/02/2023 15:23,2590-2594,ISCA,en,L1-or-L2,Interspeech 2014
2007,"Strom, Volker; Nenkova, Ani; Clark, Robert; Vazquez-Alvarez, Yolanda; Brenier, Jason; King, Simon; Jurafsky, Dan",Modelling prominence and emphasis improves unit-selection synthesis,Interspeech 2007,,10.21437/Interspeech.2007-230,https://www.isca-speech.org/archive/interspeech_2007/strom07_interspeech.html,"We describe the results of large scale perception experiments showing improvements in synthesising two distinct kinds of prominence: standard pitch-accent and strong emphatic accents. Previously prominence assignment has been mainly evaluated by computing accuracy on a prominence-labelled test set. By contrast we integrated an automatic pitch-accent classiﬁer into the unit selection target cost and showed that listeners preferred these synthesised sentences. We also describe an improved recording script for collecting emphatic accents, and show that generating emphatic accents leads to further improvements in the ﬁction genre over incorporating pitch accent only. Finally, we show differences in the effects of prominence between child-directed speech and news and ﬁction genres.",27/08/2007,22/02/2023 10:34,22/02/2023 10:34,06/02/2023 15:23,1282-1285,ISCA,en,prosody,Interspeech 2007
2022,"Suzuki, Yu; Kato, Tsuneo; Tamura, Akihiro",Automatic Prosody Evaluation of L2 English Read Speech in Reference to Accent Dictionary with Transformer Encoder,Interspeech 2022,,10.21437/Interspeech.2022-10344,https://www.isca-speech.org/archive/interspeech_2022/suzuki22b_interspeech.html,"Automatic prosody evaluation models for second language (L2) read speech are classiﬁed into two categories: reference-based and reference-free. Reference-based models refer to native speakers’ speech of the uttered text while reference-free models do not. Conventional reference-free models do not even take the uttered text into account. We propose an automatic prosody evaluation model that takes the uttered text into account by estimating native speakers’ prosodic patterns using a Transformer encoder. The Transformer encoder used in FastSpeech 2 estimates a sequence of native speakers’ prosodic features in a phoneme-segment level, and a subsequent neural network module evaluates an L2 learner’s utterance by comparing the sequence of prosodic features with the estimated sequence of native speakers’ utterances. We evaluated the model by Spearman’s correlation between the objective and subjective scores on L2 English sentence speech read by Japanese university students. The experimental results indicated that our model achieved a higher subjective-objective score correlation than that with a reference-free model and even higher than an inter-rater score correlation.",18/09/2022,22/02/2023 10:34,22/02/2023 10:34,06/02/2023 15:24,4466-4470,ISCA,en,L2,Interspeech 2022
2022,"Szalay, Tuende; Shahin, Mostafa; Ahmed, Beena; Ballard, Kirrie",Knowledge of accent differences can be used to predict speech recognition,Interspeech 2022,,10.21437/Interspeech.2022-10162,https://www.isca-speech.org/archive/interspeech_2022/szalay22_interspeech.html,"If accent differences can predict the type of speech recognition errors, a smaller dataset systematically representing accent differences might be sufficient and less resource intensive for adapting an automatic speech recognition (ASR) to a novel variety compared to training the ASR on a large, unsystematic dataset. However, it is not known whether ASR errors pattern according to accent differences. Therefore, we tested the performance of Google’s General American (GenAm) and Standard Australian English (SAusE) ASR on both dialects using words systematically representing accent differences. Accent differences were quantified using the different number of vowel phonemes, the different phonetic quality of vowels, and differences in rhoticity (i.e., presence/absence of postvocalic /ô/). Our results confirm that word recognition is significantly more accurate when ASR dialect matches the speaker dialect compared to the mismatched condition. Our results reveal that GenAm ASR is less accurate on SAusE speakers due to the higher number of vowel phonemes and the lack of postvocalic /ô/ in SAusE. Thus, the data need of adapting ASR from GenAm to SAusE might be reduced by using a small dataset focusing on differences in the size of vowel inventory and in rhoticity.",18/09/2022,22/02/2023 10:34,22/02/2023 10:34,06/02/2023 15:24,1372-1376,ISCA,en,L1-or-L2,Interspeech 2022
,"Tabain, Marija; Rickard, Kristine; Breen, Gavan; Dobson, Veronica",Central vowels in Arrernte: metrical prominence and pitch accent,,,,,"This paper presents duration and formant data for the central vowels /@/ (schwa) and /a/ in Arrernte, a central Australian language. Results show that /@/ has a shorter duration and higher position in the vowel space in metrically prominent syllables, whereas /a/ has a longer duration and no change in formant structure. By contrast, effects of pitch accent are minimal for both vowels.",,22/02/2023 10:34,22/02/2023 10:34,,,,en,prosody,
2007,"Tamburini, Fabio; Wagner, Petra",On automatic prominence detection for German,Interspeech 2007,,10.21437/Interspeech.2007-505,https://www.isca-speech.org/archive/interspeech_2007/tamburini07_interspeech.html,"Perceptual prominence is an important indicator of a word’s and syllable’s lexical, syntactic, semantic and pragmatic status in a discourse. Its automatic annotation would be a valuable enrichment of large databases used in unit selection speech synthesis and speech recognition. While much research has been carried out on the interaction between prominence and acoustic factors, little progress has been made in its automatic annotation. Previous approaches to German relied on linguistic features in prominence detection, but a purely acoustic method would be advantageous. We applied an algorithm to German data that had been previously used for English and Italian. Both the algorithm and the data annotation encode prominence as a continuous rather than a categorical parameter. First results are encouraging, but again show that prominence perception relies on linguistic expectancies as well as acoustic patterns. Also, our results further strengthen the view that force accents are a more reliable cue to prominence than pitch accents in German.",27/08/2007,22/02/2023 10:34,22/02/2023 10:34,06/02/2023 15:24,1809-1812,ISCA,en,prosody,Interspeech 2007
2007,"Tamm, Anne; Abari, Kálmán; Olaszy, Gábor","Accent assignment algorithm in Hungarian, based on syntactic analysis",Interspeech 2007,,10.21437/Interspeech.2007-220,https://www.isca-speech.org/archive/interspeech_2007/tamm07_interspeech.html,"This article presents the results of the research aimed at developing an accent assignment system for Hungarian. Two methods are compared. The shallow method targets local and short-distance factors that determine accent; the deep (syntactic) method targets long-distance influences (such as focus). Neither of the methods alone results in absolutely satisfactory output; frequently, however, mistakes are complementary. The article presents the problems and solutions of both methods.",27/08/2007,22/02/2023 10:34,22/02/2023 10:34,06/02/2023 15:24,466-469,ISCA,en,prosody,Interspeech 2007
2010,"Tanida, Yuuki; Ueno, Taiji; Saito, Satoru; Ralph, Matthew A. Lambon",Effects of accent typicality and phonotactic frequency on nonword immediate serial recall performance in Japanese,Interspeech 2010,,10.21437/Interspeech.2010-455,https://www.isca-speech.org/archive/interspeech_2010/tanida10_interspeech.html,"In a nonword serial recall experiment we found following results: (1) Phonotactically high frequent nonwords were recalled better than low ones in terms of phoneme accuracy; (2) but this phonotactic frequency effect was not observed in accent accuracy. (3) Accent typicality did not have an expected effect on phoneme recall accuracy; (4) but it had an effect on accent accuracy. These results suggest that both long-term knowledge about phoneme sequences and accent patterns have strong influences on verbal short-term memory performance, but those influences might be limited to each particular domain.",26/09/2010,22/02/2023 10:34,22/02/2023 10:34,06/02/2023 15:24,1565-1567,ISCA,en,prosody,Interspeech 2010
