Publication Year,Author,Title,Publication Title,ISBN,DOI,Url,Abstract Note,Date,Date Added,Date Modified,Access Date,Pages,Publisher,Language,Manual Tags,Conference Name
2011,"Andreeva, Bistra; Wolska, Magdalena",The “fortis-lenis” distinction in Bulgarian and German,Interspeech 2011,,10.21437/Interspeech.2011-682,https://www.isca-speech.org/archive/interspeech_2011/andreeva11_interspeech.html,"The present study investigates the voicing contrast in Bulgarian and German. Analyses of two production experiments are reported. In the first experiment logatoms were constructed containing /p, t, k/ and /b, d, g/ in intervocalic position. In the second experiment one Bulgarian and one German sentence were elicited in different focus conditions resulting in different accentuation levels. Based on the obtained data we analyze the phonetic implementation of the phonological categories voiced vs. voiceless and the influence of focus condition and accentuation. It is shown, that: First, the two languages differ in the phonetic realization of /p, t, k/ but not /b, d, g/ in intervocalic position in terms of voice onset time (short lag in Bulgarian and long lag in German). Second, accentuation levels are realised in different ways in the two languages.",27/08/2011,22/02/2023 10:34,22/02/2023 10:34,06/02/2023 15:13,2669-2672,ISCA,en,prosody,Interspeech 2011
2012,"Andreeva, Bistra; Barry, William; Wolska, Magdalena",Language differences in the perceptual weight of prominence-lending properties,Interspeech 2012,,10.21437/Interspeech.2012-635,https://www.isca-speech.org/archive/interspeech_2012/andreeva12_interspeech.html,"A Bulgarian and a German sentence were presented to Bulgarian and German listeners together with a question which either expected an early narrow focus or a late narrow focus. The answering sentences were manipulated so that the word in the latefocused position ranged from completely de-accented to strongly accented. The early focused position was neutral, allowing latefocus perception with late strong accentuation and early focus with de-accentuation of the late-focus position. Accentuation strength of the late position was varied by changing the duration, intensity and f0 values individually between accented and low de-accented. Subjects were asked to judge the suitability of the answers to the question. Results show the relative contribution of the three parameters to the acceptability of the word in the late focus position as focally accented or de-accented. Differences between Bulgarian and German in the relative weighting of the parameters are revealed.",09/09/2012,22/02/2023 10:34,22/02/2023 10:34,06/02/2023 15:13,2426-2429,ISCA,en,prosody,Interspeech 2012
2004,"Angkititrakul, Pongtep; Baghaii, Sepideh; Hansen, John H. L.",Cluster-dependent modeling and confidence measure processing for in-set/out-of-set speaker identification,Interspeech 2004,,10.21437/Interspeech.2004-537,https://www.isca-speech.org/archive/interspeech_2004/angkititrakul04_interspeech.html,"In this paper, we propose an approach to address the problem of text-independent open-set speaker identiﬁcation. The in-set speakers are clustered into smaller subsets without merging speaker models. The Anti-Speaker or Background Model is then adapted for each subset which minimizes the identiﬁcation errors of the pseudo impostors during the training stage. Score normalization is applied to align all the in-set speaker score distributions to share a single scale. Finally, conﬁdence measure processing is used to identify in-set versus out-of-set speakers. Experiments with TIMIT and the CU-Accent corpora show an improvement in Equal Error Rate on ¢ ¢ the average of 20.28 and 8.35 over the baseline performance respectively. Finally, a probe experiment is also included that considers prosody for in-set speaker detection.",04/10/2004,22/02/2023 10:34,22/02/2023 10:34,06/02/2023 15:13,2385-2388,ISCA,en,L1-or-L2,Interspeech 2004
2011,"Anumanchipalli, Gopala Krishna; Oliveira, Luís C.; Black, Alan W.",A statistical phrase/accent model for intonation modeling,Interspeech 2011,,10.21437/Interspeech.2011-36,https://www.isca-speech.org/archive/interspeech_2011/anumanchipalli11_interspeech.html,"This paper proposes a statistical phrase/accent model of voice fundamental frequency(F0) for speech synthesis. It presents an approach for automatic extraction and modeling of phrase and accent phenomena from F0 contours by taking into account their overall trends in the training data. An iterative optimization algorithm is described to extract these components, minimizing the reconstruction error of the F0 contour. This method of modeling local and global components of F0 separately is shown to be better than conventional F0 models used in Statistical Parametric Speech Synthesis (SPSS). Perceptual evaluations conﬁrm that the proposed model is signiﬁcantly better than baseline SPSS F0 models in 3 prosodically diverse tasks –read speech, radio broadcast speech and audio book speech.",27/08/2011,22/02/2023 10:34,22/02/2023 10:34,06/02/2023 15:13,1813-1816,ISCA,en,prosody,Interspeech 2011
2013,"Aryal, Sandesh; Felps, Daniel; Gutierrez-Osuna, Ricardo",Foreign accent conversion through voice morphing,Interspeech 2013,,10.21437/Interspeech.2013-671,https://www.isca-speech.org/archive/interspeech_2013/aryal13_interspeech.html,"We present a voice morphing strategy that can be used to generate a continuum of accent transformations between a foreign speaker and a native speaker. The approach performs a cepstral decomposition of speech into spectral slope and spectral detail. Accent conversions are then generated by combining the spectral slope of the foreign speaker with a morph of the spectral detail of the native speaker. Spectral morphing is achieved by representing the spectral detail through pulse density modulation and averaging pulses in a pair-wise fashion. The technique is validated on parallel recordings from two ARCTIC speakers using both objective and subjective measures of acoustic quality, speaker identity and foreign accent.",25/08/2013,22/02/2023 10:34,22/02/2023 10:34,06/02/2023 15:13,3077-3081,ISCA,en,L2,Interspeech 2013
2015,"Aryal, Sandesh; Gutierrez-Osuna, Ricardo",Articulatory-based conversion of foreign accents with deep neural networks,Interspeech 2015,,10.21437/Interspeech.2015-145,https://www.isca-speech.org/archive/interspeech_2015/aryal15_interspeech.html,"We present an articulatory-based method for real-time accent conversion using deep neural networks (DNN). The approach consists of two steps. First, we train a DNN articulatory synthesizer for the non-native speaker that estimates acoustics from contextualized articulatory gestures. Then we drive the DNN with articulatory gestures from a reference native speaker –mapped to the nonnative articulatory space via a Procrustes transform. We evaluate the accent-conversion performance of the DNN through a series of listening tests of intelligibility, voice identity and nonnative accentedness. Compared to a baseline method based on Gaussian mixture models, the DNN accent conversions were found to be 31% more intelligible, and were perceived more native-like in 68% of the cases. The DNN also succeeded in preserving the voice identity of the nonnative speaker.",06/09/2015,22/02/2023 10:34,22/02/2023 10:34,06/02/2023 15:13,3385-3389,ISCA,en,L2,Interspeech 2015
2016,"Aryal, Sandesh; Gutierrez-Osuna, Ricardo",Comparing Articulatory and Acoustic Strategies for Reducing Non-Native Accents,Interspeech 2016,,10.21437/Interspeech.2016-1131,https://www.isca-speech.org/archive/interspeech_2016/aryal16_interspeech.html,"This article presents an experimental comparison of two types of techniques, articulatory and acoustic, for transforming nonnative speech to sound more native-like. Articulatory techniques use articulators from a native speaker to drive an articulatory synthesizer of the non-native speaker. These methods have a good theoretical justification, but articulatory measurements (e.g., via electromagnetic articulography) are difficult to obtain. In contrast, acoustic methods use techniques from the voice conversion literature to build a mapping between the two acoustic spaces, making them more attractive for practical applications (e.g., language learning). We compare two representative implementations of these approaches, both based on statistical parametric speech synthesis. Through a series of perceptual listening tests, we evaluate the two approaches in terms of accent reduction, speech intelligibility and speaker quality. Our results show that the acoustic method is more effective than the articulatory method in reducing perceptual ratings of non-native accents, and also produces synthesis of higher intelligibility while preserving voice quality.",08/09/2016,22/02/2023 10:34,22/02/2023 10:34,06/02/2023 15:13,312-316,ISCA,en,L2,Interspeech 2016
2012,"Ashby, Simone; Barbosa, Sílvia; Brandão, Silvia; Ferreira, José Pedro; Janssen, Maarten; Silva, Catarina; Viaro, Mário Eduardo",A Rule Based Pronunciation Generator and Regional Accent Databank for Portuguese,,,,,"One of the major obstacles in deploying spoken language technologies (SLTs) in the developing world is a lack of key linguistic resources – e.g. electronic dictionaries, phonetically aligned corpora, pronunciation lexicons, etc. – that describe the non-dominant varieties spoken in such countries and regions. In this paper, we describe the work of the LUPo (Portuguese Unisyn Lexicon) project to model standard and non-standard varieties of spoken Portuguese from around the globe, and: (1) deliver a free, open-source tool for the automatic generation of accent-specific pronunciation lexica within the existing online lexical knowledge base, the Portal da Língua Portuguesa; and (2) provide the research and speech technology communities with a free, online, searchable database, the Portuguese RADbank, dedicated to the description of regional varieties of spoken Portuguese. Both resources are presented as bases for adapting SLTs to regional varieties spoken in the Luso-African and Luso-Asian world, as well as to non-standard varieties of Brazilian and European Portuguese.",2012,22/02/2023 10:34,22/02/2023 10:34,,,,en,L1,
,"Astrinaki, Maria; Yamagishi, Junichi; King, Simon",Reactive accent interpolation through an interactive map application,,,,,"In this paper, we present our ﬁrst prototype system for interactive accent control using HMM-based speech synthesis. In this application, voices in various English accents including American, Canadian and British, are controlled and interpolated by the user using gestures acquired via an interactive geographical map in real time. Users can choose the gender of the voices to manipulate and the accent interpolation strategy: either interpolation of all available speakers within an area or the N -nearest speakers around a point.",,22/02/2023 10:34,22/02/2023 10:34,,,,en,L1-or-L2,
2012,"Avanzi, Mathieu; Dubosson, Pauline; Schwab, Sandra; Obin, Nicolas","Accentual transfer from Swiss-German to French. a study of ""francais federal""",Interspeech 2012,,10.21437/Interspeech.2012-37,https://www.isca-speech.org/archive/interspeech_2012/avanzi12_interspeech.html,"This study aims at examining the accentual and phrasing properties of a variety of L2 French commonly called “Français Fédéral”, a variety of French spoken in Switzerland by speakers who have a Swiss-German dialect as a mother tongue. For this, we compared the data of 4 groups of 4 speakers: 2 groups of 4 native French speakers from Neuchâtel and from Paris, and 2 groups of 4 Swiss-German French speakers from Bern and Zürich. The data are semi-automatically processed, and three main prosodic features relating to accentuation and phrasing are examined: prominence distribution and metrical weight of the Phonological Phrase, respect of Phonological Phrase formation constraints (Align-XP and No-clash), and realizations of sandhis phenomena within and across the Phonological Phrases boundaries. Our findings suggest that “Français Fédéral” share several features with a lexical accentuation system rather than with a supra-lexical accentuation system.",09/09/2012,22/02/2023 10:34,22/02/2023 10:34,06/02/2023 15:13,106-109,ISCA,en,prosody,Interspeech 2012
2012,"Avanzi, Mathieu; Dubosson, Pauline; Schwab, Sandra",Effects of dialectal origin on articulation rate in French,Interspeech 2012,,10.21437/Interspeech.2012-201,https://www.isca-speech.org/archive/interspeech_2012/avanzi12b_interspeech.html,"This paper compares the articulation rate of 4 varieties of French: Parisian French (PA); Swiss French spoken in Neuchâtel (NE) and French spoken by Swiss German speakers (BE and ZH) who have been living in a French-speaking environment (in Neuchâtel) for 20 years at least. The objective is twofold: to assess the differences in articulation rate between native French speakers of a standard variety (PA) and native French speakers of a regional variety (NE), and to address whether the non-native speakers (BE and ZH) exhibit a different behavior regarding their articulation rate compared with the native speakers of the corresponding variety (NE). Aside from the ""regional"" factor, this study takes into account additional factors that may have an influence on articulation rate: the gender and age of the speakers, the speech style (reading or conversational) and the number of syllables within the Accentual Phrase.",09/09/2012,22/02/2023 10:34,22/02/2023 10:34,06/02/2023 15:13,651-654,ISCA,en,L1,Interspeech 2012
2008,"Badino, Leonardo; Clark, Robert A. J.; Strom, Volker",Including pitch accent optionality in unit selection text-to-speech synthesis,Interspeech 2008,,10.21437/Interspeech.2008-549,https://www.isca-speech.org/archive/interspeech_2008/badino08_interspeech.html,A signiﬁcant variability in pitch accent placement is found when comparing the patterns of prosodic prominence realized by different English speakers reading the same sentences.,22/09/2008,22/02/2023 10:34,22/02/2023 10:34,06/02/2023 15:13,2118-2121,ISCA,en,prosody,Interspeech 2008
2012,"Badino, Leonardo; Clark, Robert A. J.; Wester, Mirjam",Towards hierarchical prosodic prominence generation in TTS synthesis,Interspeech 2012,,10.21437/Interspeech.2012-628,https://www.isca-speech.org/archive/interspeech_2012/badino12_interspeech.html,"We address the problem of identiﬁcation (from text) and generation of pitch accents in HMM-based English TTS synthesis. We show, through a large scale perceptual test, that a large improvement of the binary discrimination between pitch accented and non-accented words has no effect on the quality of the speech generated by the system. On the other side adding a third accent type that emphatically marks words that convey ”contrastive” focus (automatically identiﬁed from text) produces beneﬁcial effects on the synthesized speech. These results support the accounts on prosodic prominence that consider the prosodic patterns of utterances as hierarchical structured and point out the limits of a ﬂattening of such structure resulting from a simple accent/non-accent distinction.",09/09/2012,22/02/2023 10:34,22/02/2023 10:34,06/02/2023 15:13,2398-2401,ISCA,en,prosody,Interspeech 2012
2007,"Barry, William; Andreeva, Bistra; Steiner, Ingmar",The phonetic exponency of phrasal accentuation in French and German,Interspeech 2007,,10.21437/Interspeech.2007-355,https://www.isca-speech.org/archive/interspeech_2007/barry07_interspeech.html,"The acoustic-phonetic properties of words spoken with three different levels of accentuation (de-accented, pre-nuclear and nuclear accented in broad-focus and nuclear accented in narrow-focus) are examined in question-answer elicited sentences and iterative imitations (on the syllable da) produced by six French and six German speakers. Normalised parameter values allow a comparative weighting of the properties employed in differentiating the three levels of accentuation. Clear differences are found between French and German in the weighting hierarchy of the acoustic properties.",27/08/2007,22/02/2023 10:34,22/02/2023 10:34,06/02/2023 15:13,1010-1013,ISCA,en,prosody,Interspeech 2007
2013,"Behravan, Hamid; Hautamäki, Ville; Kinnunen, Tomi",Foreign accent detection from spoken Finnish using i-vectors,Interspeech 2013,,10.21437/Interspeech.2013-42,https://www.isca-speech.org/archive/interspeech_2013/behravan13_interspeech.html,"I-vector based recognition is a well-established technique in state-of-the-art speaker and language recognition but its use in dialect and accent classiﬁcation has received less attention. We represent an experimental study of i-vector based dialect classiﬁcation, with a special focus on foreign accent detection from spoken Finnish. Using the CallFriend corpus, we ﬁrst study how recognition accuracy is affected by the choices of various i-vector system parameters, such as the number of Gaussians, i-vector dimensionality and reduction method. We then apply the same methods on the Finnish national foreign language certiﬁcate (FSD) corpus and compare the results to traditional Gaussian mixture model - universal background model (GMM-UBM) recognizer. The results, in terms of equal error rate, indicate that i-vectors outperform GMM-UBM as one expects. We also notice that in foreign accent detection, 7 out of 9 accents were more accurately detected by Gaussian scoring than by cosine scoring.",25/08/2013,22/02/2023 10:34,22/02/2023 10:34,06/02/2023 15:13,79-83,ISCA,en,L2,Interspeech 2013
2009,"Beňuš, Štefan",Are we `in sync': turn-taking in collaborative dialogues,Interspeech 2009,,10.21437/Interspeech.2009-618,https://www.isca-speech.org/archive/interspeech_2009/benus09b_interspeech.html,"We used a corpus of collaborative task oriented dialogues in American English to compare two units of rhythmic structure – pitch accents and syllables – within the coupled oscillator model of rhythmical entrainment in turn-taking proposed in [1]. We found that pitch accents are a slightly better fit than syllables as the unit of rhythmical structure for the model, but we also observed weak support for the model in general. Some turn-taking types were rhythmically more salient than others.",06/09/2009,22/02/2023 10:34,22/02/2023 10:34,06/02/2023 15:14,2167-2170,ISCA,en,prosody,Interspeech 2009
2006,"Beskow, Jonas; Granström, Björn; House, David",Visual correlates to prominence in several expressive modes,Interspeech 2006,,10.21437/Interspeech.2006-375,https://www.isca-speech.org/archive/interspeech_2006/beskow06_interspeech.html,"In this paper, we present measurements of visual, facial parameters obtained from a speech corpus consisting of short, read utterances in which focal accent was systematically varied. The utterances were recorded in a variety of expressive modes including certain, confirming, questioning, uncertain, happy, angry and neutral. Results showed that in all expressive modes, words with focal accent are accompanied by a greater variation of the facial parameters than are words in non-focal positions. Moreover, interesting differences between the expressions in terms of different parameters were found.",17/09/2006,22/02/2023 10:34,22/02/2023 10:34,06/02/2023 15:14,paper 1922-Tue3WeO.1-0,ISCA,en,prosody,Interspeech 2006
2013,"Best, Catherine T.; Shaw, Jason A.; Clancy, Elizabeth",Recognizing words across regional accents: the role of perceptual assimilation in lexical competition,Interspeech 2013,,10.21437/Interspeech.2013-504,https://www.isca-speech.org/archive/interspeech_2013/best13_interspeech.html,"Unfamiliar regional accents disrupt spoken word recognition by L2 and L1 learners and L1 adults, and confuse ASR and smart systems. Little is known, however, about which aspects of non-native accents hinder word recognition, or what processes are involved. We assessed how Australian English (AusE) listeners’ recognition of words in unfamiliar accents is affected by two types of cross-accent perceptual assimilation: 1) other-accent phones that constitute ‘deviant’ versions of the matching AusE phonemes (Category Goodness assimilation: CG); 2) phones that cross a native phonological boundary, i.e., assimilate to mismatching AusE phonemes (Category Shift: CS). Eyetracking (“visual world”) revealed the timecourse of lexical competition during online identification of words spoken in Jamaican (JaME: vowel differences from AusE) and Cockney English (CknE: consonant differences), while choosing among four printed choice words: target, onset and offset competitors, unrelated distracter. Recognition was slower, and both competitor types were considered more and longer for JaME and CknE than AusE pronunciations; these effects were stronger for CS than CG differences. We conclude that: 1) perceptual assimilation plays a key role in cross-accent word recognition; 2) lexical competition involves not only onsets but also later aspects of words; 3) vowel and consonant variations affect lexical competition similarly.",25/08/2013,22/02/2023 10:34,22/02/2023 10:34,06/02/2023 15:14,2128-2132,ISCA,en,L1,Interspeech 2013
2015,"Bhat, Chitralekha; Kopparapu, Sunil",Viseme comparison based on phonetic cues for varying speech accents,Interspeech 2015,,10.21437/Interspeech.2015-676,https://www.isca-speech.org/archive/interspeech_2015/bhat15_interspeech.html,"Human interaction through speech is a multisensory activity, wherein the spoken audio is perceived using both auditory and visual cues. However, in the absence of auditory stimulus, speech content can be perceived through lip reading, using the dynamics of the social context. In our earlier work [1], we had presented a tool enabling hearing impaired to understand spoken speech in videos, through lip reading. During evaluation it was found that a hearing impaired person, trained to lip read Indian English was unable to lip read speech in other accents of English. We hypothesize that this difﬁculty can be attributed to a difference in viseme formation arising from underlying phonetic characteristics. In this paper, we present a comparison between auditory and visual space for the same speech utterance in English, as spoken by an Indian and a Croatian national. Results show a clear correlation between distances in the visual and auditory domain at viseme level. We then evaluate the feasibility of building visual subtitles through viseme adaptation from unknown accent to known accent.",06/09/2015,22/02/2023 10:34,22/02/2023 10:34,06/02/2023 15:14,3412-3416,ISCA,en,L2,Interspeech 2015
2008,"Bi, Fukun; Yang, Jian; Xu, Dan",Automatic accent classification using ensemble methods,Interspeech 2008,,10.21437/Interspeech.2008-234,https://www.isca-speech.org/archive/interspeech_2008/bi08_interspeech.html,"Accent classification technologies directly influence the performance of the state-of-the-art speech recognition system. In this paper, we propose a novel scheme for accent classification, which uses decision-templates (DT) ensemble algorithm to combine base classifiers built on acoustic feature subsets. Different feature subsets can provide sufficient diversity among base classifiers, which is known as a necessary condition for improvement in ensemble performance. Compared with those methods of Majority Voting ensemble and Support Vector Machine, our ensemble scheme can achieve the highest performance. On the other hand, we investigate the possible reasons why ensemble systems can provide potential performance, in terms of diversity analysis. In our experiments, a native Mandarin speech corpus and a non-native multi-accent Mandarin speech corpus which contains three typical minorities’ accents in Yunnan, China, are adopted.",22/09/2008,22/02/2023 10:34,22/02/2023 10:34,06/02/2023 15:14,755-758,ISCA,en,L1,Interspeech 2008
2011,"Biadsy, Fadi; Hirschberg, Julia; Ellis, Daniel P. W.",Dialect and accent recognition using phonetic-segmentation supervectors,Interspeech 2011,,10.21437/Interspeech.2011-285,https://www.isca-speech.org/archive/interspeech_2011/biadsy11_interspeech.html,"We describe a new approach to automatic dialect and accent recognition which exceeds state-of-the-art performance in three recognition tasks. This approach improves the accuracy and substantially lower the time complexity of our earlier phoneticbased kernel approach for dialect recognition. In contrast to state-of-the-art acoustic-based systems, our approach employs phone labels and segmentation to constrain the acoustic models. Given a speaker’s utterance, we ﬁrst obtain phone hypotheses using a phone recognizer and then extract GMM-supervectors for each phone type, effectively summarizing the speaker’s phonetic characteristics in a single vector of phone-type supervectors. Using these vectors, we design a kernel function that computes the phonetic similarities between pairs of utterances to train SVM classiﬁers to identify dialects. Comparing this approach to the state-of-the-art, we obtain a 12.9% relative improvement in EER on Arabic dialects, and a 17.9% relative improvement for American vs. Indian English dialects. We also see a 53.5% relative improvement over a GMM-UBM on American Southern vs. Non-Southern English.",27/08/2011,22/02/2023 10:34,22/02/2023 10:34,06/02/2023 15:14,745-748,ISCA,en,L1,Interspeech 2011
