Publication Year,Author,Title,Publication Title,ISBN,DOI,Url,Abstract Note,Date,Date Added,Date Modified,Access Date,Pages,Publisher,Language,Manual Tags,Conference Name
2006,"Li, Aijun; Fang, Qiang; Xiong, Ziyu","Phonetic research on accented Chinese in three dialectal regions: Shanghai, Wuhan and Xiamen",Interspeech 2006,,10.21437/Interspeech.2006-245,https://www.isca-speech.org/archive/interspeech_2006/li06e_interspeech.html,"There are 10 major dialects in China. Most people in dialectal regions are bilingual speakers, i.e. native dialect and Mandarin. Although lots of people can speak Mandarin, they speak it with different accents (called regional accented Chinese in this paper) depending on how well they grasp the language. In this study, we categorize the regional accented Chinese into 3 levels of accents according to phonetic annotation and subjective evaluation on a regional accented speech corpus of three regions: Shanghai, Wuhan and Xiamen. Three accent evaluation methods, namely segmental annotation, clustering on phonetic annotation and subjective evaluation, are compared based on phonetic error rates. The results show that objective evaluation score based on segmental pronunciation is higher than subjective evaluation for the same speaker. This implies that supra-segmental features play an important role in rating accent degree and segmental features alone are not enough for objective evaluation. In accent level criterion, the errors from prosodic and segmental aspects are not equal and the percentage of these two parts are various for different regional speakers. The result is helpful for machine evaluation, L2 teaching and acquisition.",17/09/2006,22/02/2023 10:36,07/03/2023 11:32,30/01/2023 14:18,paper 1143-Mon3FoP.4-0,ISCA,en,mandarin; L1; not-tech; speech-error-detection; accent-in-title,Interspeech 2006
2020,"Li, Yanping; Best, Catherine T.; Tyler, Michael D.; Burnham, Denis",Tone Variations in Regionally Accented Mandarin,Interspeech 2020,,10.21437/Interspeech.2020-1235,https://www.isca-speech.org/archive/interspeech_2020/li20ja_interspeech.html,"The present study investigated tone variations in regionally accented Mandarin (i.e., Standard Mandarin [SM] spoken by dialectal Chinese speakers) as influenced by the varying tone systems of their native dialects. 12 female speakers, four each from Guangzhou, Shanghai and Yantai, were recruited to produce monosyllabic words in SM that included minimal contrasts among the four Mandarin lexical tones. Since SM developed from the Beijing dialect, their pronunciations were compared to the same Mandarin words produced by four Beijing female speakers. Regional Mandarin speakers successfully produced the four Mandarin lexical tones, but their productions varied from SM. Two crucial acoustic measures for Mandarin lexical tones, F0 (fundamental frequency) and duration values, were fitted into linear mixed-effects models on differences between regional and Beijing accents. Regional speakers had longer word duration and different F0 height when producing SM, resulting in variations in Mandarin lexical tones across the regional accents. These findings shed light on regional accent variations in Mandarin lexical tones and lay a foundation for deeper understanding of their impact on perception of accented Mandarin lexical tones by native (Beijing) Mandarin listeners.",25/10/2020,22/02/2023 10:36,07/03/2023 12:49,30/01/2023 14:18,4158-4162,ISCA,en,mandarin; L1; not-tech; description-of-accent; perception-study; accent-in-title; speaker-description; listener-description,Interspeech 2020
2005,"Liu, Yi; Fung, Pascale",Acoustic and phonetic confusions in accented speech recognition,Interspeech 2005,,10.21437/Interspeech.2005-147,https://www.isca-speech.org/archive/interspeech_2005/liu05_interspeech.html,"Accented speech recognition is more challenging than standard speech recognition due to the effects of phonetic and acoustic confusions. Phonetic confusion in accented speech occurs when an expected phone is pronounced as a different one, which leads to erroneous recognition. Acoustic confusion occurs when the pronounced phone is found to lie acoustically between two baseform models and can be equally recognized as either one. We propose that it is necessary to analyze and model these confusions separately in order to improve accented speech recognition without degrading standard speech recognition. We propose using likelihood ratio test to measure phonetic confusion, and asymmetric acoustic distance to measure acoustic confusion. Only accent-specific phonetic units with low acoustic confusion are used in an augmented pronunciation dictionary, while phonetic models with high acoustic confusion are reconstructed using decision tree merging. Experimental results show that our approach is effective and superior to methods modeling phonetic confusion or acoustic confusion alone in accented speech, with a significant 5.7% absolute WER reduction, without degrading standard speech recognition.",04/09/2005,22/02/2023 10:36,27/02/2023 07:52,30/01/2023 14:18,3033-3036,ISCA,en,ASR; L1-or-L2; no def; some-description,Interspeech 2005
2017,"Maastricht, Lieke van; Zee, Tim; Krahmer, Emiel; Swerts, Marc","L1 Perceptions of L2 Prosody: The Interplay Between Intonation, Rhythm, and Speech Rate and Their Contribution to Accentedness and Comprehensibility",Interspeech 2017,,10.21437/Interspeech.2017-1150,https://www.isca-speech.org/archive/interspeech_2017/maastricht17_interspeech.html,"This study investigates the cumulative effect of (non-)native intonation, rhythm, and speech rate in utterances produced by Spanish learners of Dutch on Dutch native listeners’ perceptions. In order to assess the relative contribution of these language-specific properties to perceived accentedness and comprehensibility, speech produced by Spanish learners of Dutch was manipulated using transplantation and resynthesis techniques. Thus, eight manipulation conditions reflecting all possible combinations of L1 and L2 intonation, rhythm, and speech rate were created, resulting in 320 utterances that were rated by 50 Dutch natives on their degree of foreign accent and ease of comprehensibility.",20/08/2017,22/02/2023 10:36,07/03/2023 13:55,30/01/2023 14:18,364-368,ISCA,en,L2; not-tech; perception-study; definition; some-description; accentedness-rating; speaker-description; listener-description,Interspeech 2017
2013,"Michelas, Amandine; Portes, Cristel; Champagne-Lavau, Maud",Intonational contrasts encode speaker's certainty in neutral vs. incredulity declarative questions in French,Interspeech 2013,,10.21437/Interspeech.2013-227,https://www.isca-speech.org/archive/interspeech_2013/michelas13_interspeech.html,"While recent crosslinguistic studies have shown that the degree of speaker’s commitment or certainty is encoded intonationally either in a gradient or categorical fashion, our understanding of how French speakers use Intonational-Phrase (IP) final contours to signal their degree of certainty is limited. This paper investigates the contribution of a penultimate peak contour in French to convey speakers’ uncertainty. Participants read target sentences in a neutral vs. incredulity declarative question context. Prosodic annotation revealed that incredulity declarative questions consistently exhibited the presence of an additional f0 peak in the penultimate syllable of the IP which was unaccented. The acoustic analyses showed that the H tone of the unaccented penultimate peak was not downstepped and thus approximately scaled to the same height of the last pitch accent. The findings of this study provide the first quantitative description of a phonological contrast between H*H% and H+ H*H% to signal speakers’ certainty in declarative questions in French.",25/08/2013,22/02/2023 10:36,22/02/2023 10:36,30/01/2023 14:18,783-787,ISCA,en,prosody,Interspeech 2013
2014,"Motlicek, Petr; Imseng, David; Cernak, Milos; Kim, Namhoon",Development of bilingual ASR system for MediaParl corpus,Interspeech 2014,,10.21437/Interspeech.2014-342,https://www.isca-speech.org/archive/interspeech_2014/motlicek14_interspeech.html,"The development of an Automatic Speech Recognition (ASR) system for the bilingual MediaParl corpus is challenging for several reasons: (1) reverberant recordings, (2) accented speech, and (3) no prior information about the language. In that context, we employ frequency domain linear prediction-based (FDLP) features to reduce the effect of reverberation, exploit bilingual deep neural networks applied in Tandem and hybrid acoustic modeling approaches to signiﬁcantly improve ASR for accented speech and develop a fully bilingual ASR system using entropy-based decoding-graph selection. Our experiments indicate that the proposed bilingual ASR system performs similar to a language-speciﬁc ASR system if approximately ﬁve seconds of speech are available.",14/09/2014,22/02/2023 10:36,26/02/2023 12:51,30/01/2023 14:18,1391-1394,ISCA,en,ASR; L2; no-description-of-accent; no-def,Interspeech 2014
2014,"Najafian, Maryam; DeMarco, Andrea; Cox, Stephen; Russell, Martin",Unsupervised model selection for recognition of regional accented speech,Interspeech 2014,,10.21437/Interspeech.2014-495,https://www.isca-speech.org/archive/interspeech_2014/najafian14_interspeech.html,"This paper is concerned with automatic speech recognition (ASR) for accented speech. Given a small amount of speech from a new speaker, is it better to apply speaker adaptation to the baseline, or to use accent identiﬁcation (AID) to identify the speaker’s accent and select an accent-dependent acoustic model? Three accent-based model selection methods are investigated: using the ‘true’ accent model, and unsupervised model selection using i-Vector and phonotactic-based AID. All three methods outperform the unadapted baseline. Most signiﬁcantly, AID-based model selection using 43s of speech performs better than unsupervised speaker adaptation, even if the latter uses ﬁve times more adaptation data. Combining unsupervised AIDbased model selection and speaker adaptation gives an average relative reduction in ASR error rate of up to 47%.",14/09/2014,22/02/2023 10:36,26/02/2023 10:56,30/01/2023 14:18,2967-2971,ISCA,en,english; ASR; L1; description-of-accent; definition,Interspeech 2014
2022,"Nguyen, Tuan Nam; Pham, Ngoc-Quan; Waibel, Alexander",Accent Conversion using Pre-trained Model and Synthesized Data from Voice Conversion,Interspeech 2022,,10.21437/Interspeech.2022-10729,https://www.isca-speech.org/archive/interspeech_2022/nguyen22d_interspeech.html,"Accent conversion (AC) aims to generate synthetic audios by changing the pronunciation pattern and prosody of source speakers (in source audios) while preserving voice quality and linguistic content. There has not been a parallel corpus that contains pairs of audios having the same contents yet coming from the same speakers in different accents, the authors hence work on a solution to synthesize one as training input. The training pipeline is conducted via two steps. First, a voice conversion (VC) model is constructed to synthesize a training data set, containing pairs of audios in the same voice but two different accents. Second, an AC model is trained with the synthesized data to convert a source accented speech to a target accented speech. Given the recognized success of self-supervised learning speech representation (wav2vec 2.0) on certain speech problems such as VC, speech recognition, speech translation, and speech-tospeech translation, we adopt this architecture with some customization to train the AC model in the second step. With just 9-hour synthesized training data, the encoder initialized by the weight of the pre-trained wav2vec 2.0 model outperforms the LSTM-based encoder.",18/09/2022,22/02/2023 10:36,27/02/2023 08:20,30/01/2023 14:18,2583-2587,ISCA,en,L1-or-L2; voice-conversion; no-description-of-accent; no-def,Interspeech 2022
2013,"Ní Chasaide, Ailbhe; Yanushevskaya, Irena; Kane, John; Gobl, Christer",The voice prominence hypothesis: the interplay of F0 and voice source features in accentuation,Interspeech 2013,,10.21437/Interspeech.2013-759,https://www.isca-speech.org/archive/interspeech_2013/nichasaide13_interspeech.html,"This paper explores the interplay of source correlates of accentuation, examining a hypothesis (the Voice Prominence Hypothesis) that different source parameters are involved and may serve as equivalent. It predicts that where accentuation is not marked by pitch salience there will be more extensive changes in other source parameters. This follows our assumption that prosodic entities such as accentuation, focus, declination, etc. involve adjustments to the entire voice source and not simply to F0. Twelve 3-accent sentences of Connemara Irish (declaratives, WH questions and Yes/No questions) were analysed. These are typically produced and transcribed as H* H* H*L. Of particular interest were the second accents: although they are heard as accented, there are no particular pitch excursions that would account for their salience. Inverse filtering and subsequent source parameterisation was carried out to yield measures for a range of source parameters. Results support the voice prominence hypothesis: as predicted, the most striking source adjustments were found in the second accent. Even where there is substantial pitch movement (final accent), parameters other than F0 appear to be contributing to the salience of the accented syllable. The precise source changes associated with accentuation varied across sentence types and within the prosodic phrase.",25/08/2013,22/02/2023 10:36,22/02/2023 10:36,30/01/2023 14:18,3527-3531,ISCA,en,prosody,Interspeech 2013
2019,"Pellegrini, Thomas; Farinas, Jérôme; Delpech, Estelle; Lancelot, François",The Airbus Air Traffic Control Speech Recognition 2018 Challenge: Towards ATC Automatic Transcription and Call Sign Detection,Interspeech 2019,,10.21437/Interspeech.2019-1962,https://www.isca-speech.org/archive/interspeech_2019/pellegrini19_interspeech.html,"In this paper, we describe the outcomes of the challenge organized and run by Airbus and partners in 2018 on Air Trafﬁc Control (ATC) speech recognition. The challenge consisted of two tasks applied to English ATC speech: 1) automatic speechto-text transcription, 2) call sign detection (CSD). The registered participants were provided with 40 hours of speech along with manual transcriptions. Twenty-two teams submitted predictions on a ﬁve hour evaluation set. ATC speech processing is challenging for several reasons: high speech rate, foreignaccented speech with a great diversity of accents, noisy communication channels. The best ranked team achieved a 7.62% Word Error Rate and a 82.41% CSD F1-score. Transcribing pilots’ speech was found to be twice as harder as controllers’ speech. Remaining issues towards solving ATC ASR are also discussed in the paper.",15/09/2019,22/02/2023 10:36,27/02/2023 08:05,30/01/2023 14:18,2993-2997,ISCA,en,ASR; L1-or-L2; no-description-of-accent; no-def,Interspeech 2019
2022,"Pérez Ramón, Rubén; Cooke, Martin; Garcia Lecumberri, Maria Luisa",Generating iso-accented stimuli for second language research: methodology and a dataset for Spanish-accented English,Interspeech 2022,,10.21437/Interspeech.2022-850,https://www.isca-speech.org/archive/interspeech_2022/perezramon22_interspeech.html,"A non-native accent can be conveyed at both the segmental and suprasegmental level. Previous studies have developed techniques to isolate the effect of segmental foreign accent by splicing accented segments from a bilingual speaker into nonaccented words produced by the same speaker. The current work addresses the issue of between-segment variability by developing a technique to convert from acoustically-equal accent gradations to perceptually-equal steps. The procedure is used to derive the ﬁrst corpus of Spanish-accented English composed of lexical tokens each generated with one of ﬁve degrees of nonnative accent. As an example application, corpus tokens are used to elicit accentedness judgements from four listener cohorts with ﬁrst languages which differ as to whether they share the native language, the non-native (accented) language of the corpus or have a closer phonological inventory to one or the other. Findings highlight the importance of the relationship between listeners’ phonological systems and those of the native and non-native languages of the corpus, especially for vowels, with respect to sensitivity to foreign accent.",18/09/2022,22/02/2023 10:36,07/03/2023 13:39,30/01/2023 14:18,1846-1850,ISCA,en,L2; not-tech; description-of-accent; perception-study; accentedness-rating; accent-in-title; speaker-description; listener-description,Interspeech 2022
2005,"Psutka, Josef; Ircing, Pavel; Psutka, J. V.; Hajic, Jan; Byrne, William J.; Mírovský, Jirí","Automatic transcription of Czech, Russian, and Slovak spontaneous speech in the MALACH project",Interspeech 2005,,10.21437/Interspeech.2005-489,https://www.isca-speech.org/archive/interspeech_2005/psutka05_interspeech.html,"This paper describes the 3.5-years effort put into building LVCSR systems for recognition of spontaneous speech of Czech, Russian, and Slovak witnesses of the Holocaust in the MALACH project. For processing of colloquial, highly emotional and heavily accented speech of elderly people containing many non-speech events we have developed techniques that very effectively handle both non-speech events and colloquial and accented variants of uttered words. Manual transcripts as one of the main sources for language modeling were automatically „normalized” using standardized lexicon, which brought about 2 to 3% reduction of the word error rate (WER). The subsequent interpolation of such LMs with models built from an additional collection (consisting of topically selected sentences from general text corpora) resulted into an additional improvement of performance of up to 3 % .",04/09/2005,22/02/2023 10:36,07/03/2023 11:33,30/01/2023 14:19,1349-1352,ISCA,en,ASR; L1; description-of-accent; lang-in-title,Interspeech 2005
2015,"Rasipuram, Ramya; Cernak, Milos; Nachen, Alexandre; Magimai-Doss, Mathew",Automatic accentedness evaluation of non-native speech using phonetic and sub-phonetic posterior probabilities,Interspeech 2015,,10.21437/Interspeech.2015-233,https://www.isca-speech.org/archive/interspeech_2015/rasipuram15_interspeech.html,"Automatic evaluation of non-native speech accentedness has potential implications for not only language learning and accent identiﬁcation systems but also for speaker and speech recognition systems. From the perspective of speech production, the two primary factors inﬂuencing the accentedness are the phonetic and prosodic structure. In this paper, we propose an approach for automatic accentedness evaluation based on comparison of instances of native and non-native speakers at the acoustic-phonetic level. Speciﬁcally, the proposed approach measures accentedness by comparing phone class conditional probability sequences corresponding to the instances of native and non-native speakers, respectively. We evaluate the proposed approach on the EMIME bilingual and EMIME Mandarin bilingual corpora, which contains English speech from native English speakers and various non-native English speakers, namely Finnish, German and Mandarin. We also investigate the inﬂuence of the granularity of the phonetic unit representation on the performance of the proposed accentedness measure. Our results indicate that the accentedness ratings by the proposed approach correlate consistently with the human ratings of accentedness. In addition, our studies show that the granularity of the phonetic unit representation that yields the best correlation with the human accentedness ratings varies with respect to the native language of the non-native speakers.",06/09/2015,22/02/2023 10:36,07/03/2023 13:42,30/01/2023 14:19,648-652,ISCA,en,english; L2; perception-study; some-description; accentedness-rating; no-listener-description; no-speaker-description,Interspeech 2015
2019,"Roessig, Simon; Mücke, Doris; Pagel, Lena",Dimensions of Prosodic Prominence in an Attractor Model,Interspeech 2019,,10.21437/Interspeech.2019-2227,https://www.isca-speech.org/archive/interspeech_2019/roessig19_interspeech.html,"Speakers of intonation languages use bundles of cues to express prosodic prominence. This work contributes further evidence for the multi-dimensionality of prosodic prominence in German reporting articulatory (3D EMA) and acoustic recordings from 27 speakers. In particular, we show that speakers use speciﬁc categorical and continuous modiﬁcations of the laryngeal system (tonal onglide) as well as continuous modiﬁcations of the supra-laryngeal system (lip aperture and tongue body position) to mark focus structure prosodically. These modiﬁcations are found between unaccented and accented but also within the group of accented words, revealing that speakers use prosodic modulations to directly encode prominence. On the basis of these ﬁndings we develop a dynamical model of prosodic patterns that is able to capture the manipulations as the modulation of an attractor landscape that is shaped by the different prosodic dimensions involved.",15/09/2019,22/02/2023 10:36,22/02/2023 10:36,30/01/2023 14:19,2533-2537,ISCA,en,prosody,Interspeech 2019
2012,"Rosenberg, Andrew",Using prominence and phrasing predictions to improve weighted dictionary pronunciation models,Interspeech 2012,,10.21437/Interspeech.2012-631,https://www.isca-speech.org/archive/interspeech_2012/rosenberg12c_interspeech.html,"Prosody impacts the pronunciation variation of lexical items in a number of ways. Accented syllables tend to be pronounced with their canonical (dictionary) vowel. Deaccented vowels are more likely to be reduced. Coarticulatory inﬂuences rarely span intonational phrase boundaries. In this work, we investigate the use of automatically generated prosodic hypotheses to improve a weighted dictionary pronunciation model. We use the phonemically transcribed, Buckeye Corpus for this investigation. We ﬁnd that predictions of pitch accent and intonational phrase boundaries can be used to lower pronunciation model perplexity.",09/09/2012,22/02/2023 10:36,22/02/2023 10:36,30/01/2023 14:19,2410-2413,ISCA,en,prosody,Interspeech 2012
2006,"Sakti, Sakriani; Markov, Konstantin; Nakamura, Satoshi","The use of Bayesian network for incorporating accent, gender and wide-context dependency information",Interspeech 2006,,10.21437/Interspeech.2006-438,https://www.isca-speech.org/archive/interspeech_2006/sakti06_interspeech.html,"We propose a new method of incorporating the additional knowledge of accent, gender, and wide-context dependency information into ASR systems by utilizing the advantages of Bayesian networks. First, we only incorporate pentaphone-context dependency information. After that, accent and gender information are also integrated. In this method, we can easily extend conventional triphone HMMs to cover various sources of knowledge. The probabilistic dependencies between a triphone context unit and additional knowledge are learned through a BN. Another advantage is that during recognition, additional knowledge variables are assumed to be hidden, so that the existing standard triphone-based decoding system can be used without modiﬁcation. The performance of the proposed model was evaluated on an LVCSR task using two different types of accented English speech data. Experimental results show that this proposed method improves word accuracy with respect to standard triphone models.",17/09/2006,22/02/2023 10:36,27/02/2023 07:57,30/01/2023 14:19,paper 1812-Wed1BuP.4-0,ISCA,en,ASR; L1-or-L2; no-description-of-accent,Interspeech 2006
2012,"Scharenborg, Odette; Witteman, Marijt; Weber, Andrea",Computational modelling of the recognition of foreign-accented speech,Interspeech 2012,,10.21437/Interspeech.2012-267,https://www.isca-speech.org/archive/interspeech_2012/scharenborg12b_interspeech.html,"In foreign-accented speech, pronunciation typically deviates from the canonical form to some degree. For native listeners, it has been shown that word recognition is more difficult for strongly-accented words than for less strongly-accented words. Furthermore recognition of strongly-accented words becomes easier with additional exposure to the foreign accent. In this paper, listeners’ behaviour was simulated with Fine-tracker, a computational model of word recognition that uses real speech as input. The simulations showed that, in line with human listeners, 1) Fine-Tracker’s recognition outcome is modulated by the degree of accentedness and 2) it improves slightly after brief exposure with the accent. On the level of individual words, however, Fine-tracker failed to correctly simulate listeners’ behaviour, possibly due to differences in overall familiarity with the chosen accent (German-accented Dutch) between human listeners and Fine-Tracker.",09/09/2012,22/02/2023 10:36,26/02/2023 12:21,30/01/2023 14:19,883-886,ISCA,en,ASR; L2; some-description; foreign-accent,Interspeech 2012
